title,description,url,publishedAt,source,image
Foreign Investors Eye Japanese Markets Amid Election Uncertainty,"Foreign investors show strong interest in Japanese stocks and AI-related technology stocks, driven by a weaker yen and robust quarterly earnings from TSMC. Despite apprehensions about upcoming elections, foreign demand propels the Topix index to record highs. Meanwhile, Japanese investors acquire substantial foreign assets.",https://www.devdiscourse.com/article/law-order/3516352-foreign-investors-eye-japanese-markets-amid-election-uncertainty,2025-07-25T05:09:06Z,Devdiscourse,https://www.devdiscourse.com/remote.axd?https://devdiscourse.blob.core.windows.net/aiimagegallery/13_07_2025_03_40_57_0242525.png?width=920&format=jpeg
The real winners from Trump’s ‘AI action plan’? Tech companies,"Millions spent by Alphabet, Meta, Microsoft and others appear to have paid off as president vows to cut red tape",https://www.theguardian.com/technology/2025/jul/25/trump-ai-action-plan,2025-07-25T05:00:51Z,The Guardian,"https://i.guim.co.uk/img/media/dbda5707f5a9497a805003b861dffeafca8c55de/0_0_4211_3369/master/4211.jpg?width=1200&height=630&quality=85&auto=format&fit=crop&precrop=40:21,offset-x50,offset-y0&overlay-align=bottom%2Cleft&overlay-width=100p&overlay-base64=L2ltZy9zdGF0aWMvb3ZlcmxheXMvdGctZGVmYXVsdC5wbmc&enable=upscale&s=1a4b35bdb47b0154c42b05fea8fbef57"
AR Rahman Meets Sam Altman at OpenAI Office to Discuss AI in Music,"Music icon A. R. Rahman met OpenAI CEO Sam Altman at his office to discuss Secret Mountain, a global virtual band initiative that empowers Indian creators and promotes the use of AI to tackle generational challenges.",https://analyticsindiamag.com/ai-news-updates/ar-rahman-meets-sam-altman-at-openai-office-to-discuss-ai-in-music/,2025-07-25T03:59:28Z,Analytics India Magazine,https://analyticsindiamag.com/wp-content/uploads/2025/04/AR-Rahman-on-AI-In-Music.jpg
How culture and emotion drive ChatGPT use in emerging digital societies,"The research shows that human-AI interaction is heavily shaped by cultural context. In Indonesia, a society rooted in collectivism, politeness, and social warmth, users often engage ChatGPT in ways that mirror interpersonal norms. The AI is greeted politely, corrected gently, and even comforted when it apologizes for errors.",https://www.devdiscourse.com/article/technology/3513642-how-culture-and-emotion-drive-chatgpt-use-in-emerging-digital-societies,2025-07-25T03:41:48Z,Devdiscourse,https://www.devdiscourse.com/remote.axd?https://devdiscourse.blob.core.windows.net/devnews/22_07_2025_13_11_31_6776184.png?width=920&format=jpeg
FACT CHECK: Video of family swept away by Crising flood is AI-generated,AI detection tools flagged the use of deepfake and face manipulation in the video. There are also no reports linking the incident shown in the video to Tropical Storm Crising.,https://www.rappler.com/newsbreak/fact-check/video-family-swept-away-crising-flood-ai-generated/,2025-07-25T03:24:17Z,Rappler,https://www.rappler.com/tachyon/2025/07/fact-check-ls-3-1.jpg
How Much Did Kristin Cabot Earn At Astronomer? Ex-HR Chief’s Salary Revealed,"Kristin Cabot, the former Chief People Officer at artificial intelligence firm Astronomer, has officially exited the company",https://www.news18.com/business/how-much-did-kristin-cabot-earn-at-astronomer-ex-hr-chiefs-salary-revealed-9462303.html,2025-07-25T02:55:17Z,News18,https://images.news18.com/ibnlive/uploads/2025/07/DYK-Snakes-and-Ladders-was-originated-in-India-2025-07-18T111802.159-2025-07-6462a713e97417139346b0396f25c3e2-16x9.png
"AI investment is already huge. Google, Trump show much more is coming.",Google will spend $85 billion on artificial-intelligence projects this year. Its rivals are likely to spend more.,https://www.livemint.com/global/ai-investment-is-already-huge-google-trump-show-much-more-is-coming-11753407231150.html,2025-07-24T18:30:00Z,Livemint,https://www.livemint.com/lm-img/img/2025/07/25/1600x900/EU-ALPHABET-ANTITRUST-0_1753407768450_1753407776774.JPG
Apple publishes Human-Centered Machine Learning workshop,"Today, Apple published on its Machine Learning Research blog, select recordings from its 2024 Workshop on Human-Centered Machine Learning.",https://9to5mac.com/2025/07/24/apple-publishes-human-centered-machine-learning-workshop-videos/,2025-07-24T23:01:33Z,9to5Mac,https://i0.wp.com/9to5mac.com/wp-content/uploads/sites/6/2025/07/machine-learning-research.jpg?resize=1200%2C628&quality=82&strip=all&ssl=1
Is ChatGPT Making Us Smarter or Dumbing Us Down?,"The rapid rise of ChatGPT and similar generative AI tools raises questions about their impact on human cognition. While these tools offer efficiencies and capabilities, overreliance could lead to intellectual complacency. The key is how individuals integrate AI into their cognitive processes—using it either as a substitute or a supplement to critical thinking.",https://www.devdiscourse.com/article/technology/3516231-is-chatgpt-making-us-smarter-or-dumbing-us-down,2025-07-25T03:04:44Z,Devdiscourse,https://www.devdiscourse.com/remote.axd?https://devdiscourse.blob.core.windows.net/aiimagegallery/15_07_2024_12_54_24_0658746.png?width=920&format=jpeg
AI-backed medical debt company claims payment plans can help US healthcare costs,PayZen’s model relies on buying hospital debt at discount as Republican cuts set to leave millions without insurance,https://www.theguardian.com/us-news/2025/jul/25/payzen-medical-debt-company-payment-plans,2025-07-25T11:00:23Z,The Guardian,"https://i.guim.co.uk/img/media/e91f7a240ec13a171d2b829e4a7ffc9d99b4b138/390_0_3879_3105/master/3879.jpg?width=1200&height=630&quality=85&auto=format&fit=crop&precrop=40:21,offset-x50,offset-y0&overlay-align=bottom%2Cleft&overlay-width=100p&overlay-base64=L2ltZy9zdGF0aWMvb3ZlcmxheXMvdGctZGVmYXVsdC5wbmc&enable=upscale&s=5d3d040e8e1385938f548a2c779577c6"
Only eagle-eyed people can spot the AI-generated fruit photo in 10 seconds or less - can you?,"TEST your vision to the max with this mind boggling brainteaser.AI is increasingly becoming part of our everyday lives, with Brits using sites such as",https://www.thesun.ie/news/15594424/spot-ai-fruit-photo-challenge/,2025-07-25T10:54:58Z,The Irish Sun,https://www.thesun.ie/wp-content/uploads/sites/3/2025/07/newspress-collage-zggcdfytd-1753440818364.jpg?1753444578&strip=all&quality=100&w=1920&h=1080&crop=1
UK-India FTA Pushes for Source Code Protection of AI and Software Companies,This move not only benefits large IT firms and startups in India but also strengthens trust among UK buyers in the reliability of tech services.,https://analyticsindiamag.com/ai-news-updates/uk-india-fta-pushes-for-source-code-protection-of-ai-and-software-companies/,2025-07-25T10:26:18Z,Analytics India Magazine,https://analyticsindiamag.com/wp-content/uploads/2013/10/socialdigitalanalytics.png
Kerala HC issues policy for use of AI for judiciary work: What does it say? Why is it significant?,"With the proliferation of AI tools, the Kerala High Court has come up with guidelines for their use in judiciary. The court has limited the use of such tools, and differentiates between 'general' AI tools and 'approved' AI tools",https://indianexpress.com/article/explained/explained-global/kerala-hc-policy-ai-10149077/,2025-07-25T10:04:16Z,The Indian Express,https://images.indianexpress.com/2025/07/gavel-IE_83be48.jpg
AI Does Coding But What About Welding? ‘Chai-Sutta’ Emerges As Winner In This Crucial Job Debate,"Entrepreneur's X-post highlights AI replacing coders in India, sparking debate on the need for hands-on skills like welding and electrical work in factories.",https://www.news18.com/viral/ai-does-coding-but-what-about-welding-chai-sutta-winner-in-crucial-job-debate-ws-l-aa-aa-aa-9463182.html,2025-07-25T09:52:54Z,News18,https://images.news18.com/ibnlive/uploads/2025/07/Untitled-design-2025-07-25T152221.501-2025-07-2036c11112e5f7dfe72a28b39bbcdda3-16x9.jpg
Mistral’s new “environmental audit” shows how much AI is hurting the planet,"Individual prompts don’t cost much, but billions together can have aggregate impact.",https://arstechnica.com/ai/2025/07/mistrals-new-environmental-audit-shows-how-much-ai-is-hurting-the-planet/,2025-07-25T17:11:50Z,Ars Technica,https://cdn.arstechnica.net/wp-content/uploads/2025/07/GettyImages-1318519629-1152x648.jpg
"Fadnavis Meets Top Union Ministers, Pushes Big Development Projects For Maharashtra",The CM has signalled that Maharashtra’s development agenda remains aggressive and focused—from roads and fertilisers to environment and AI-backed health screening,https://www.news18.com/india/fadnavis-meets-top-union-ministers-pushes-big-development-projects-for-maharashtra-9464208.html,2025-07-25T16:26:52Z,News18,https://images.news18.com/ibnlive/uploads/2025/03/fadnavis-2025-03-3f040100a35d31704d4539901ef3f71d-16x9.png
White House lashes out at ‘South Park’ Trump parody,"LOS ANGELES, California — The White House lashed out at the creators of “South Park” on Thursday after the bawdy satirical program skewered Donald Trump in an episode featuring an artificial intelligence (AI)-generated version of the United States president crawling naked through a desert.",https://www.manilatimes.net/2025/07/26/world/americas-emea/white-house-lashes-out-at-south-park-trump-parody/2156324,2025-07-25T16:03:00Z,The Manila Times,https://www.manilatimes.net/manilatimes/uploads/images/2025/07/25/690087.jpg
India ready share AI models with Global South: IT Secretary S Krishnan,"While speaking at FICCIs conference Bhashantara 2025, Electronics and IT Secretary S Krishnan said that the development of technology for languages to help people communicate in a frictionless manner can lead to huge value addition to the economy.",https://www.devdiscourse.com/article/technology/3517290-india-ready-share-ai-models-with-global-south-it-secretary-s-krishnan,2025-07-25T15:07:10Z,Devdiscourse,https://www.devdiscourse.com/remote.axd?https://devdiscourse.blob.core.windows.net/imagegallery/27_06_2019_18_33_47_4854533.png?width=920&format=jpeg
"To predict wildfires, tech must focus on ‘the unimaginable’","Plus, EV battery plant workers unionize and Canadian pension funds double down on AI.",https://www.thestar.com/business/tech-update-to-predict-future-wildfires-digital-models-must-focus-on-the-unimaginable/article_0203b99e-bc3e-489f-a527-a65427536599.html,2025-07-25T15:00:00Z,Toronto Star,https://bloximages.chicago2.vip.townnews.com/thestar.com/content/tncms/assets/v3/editorial/d/0c/d0ca623a-4900-5a48-a7f3-65addfc4297b/6883968d969bc.image.jpg?crop=1763%2C926%2C0%2C125&resize=1200%2C630&order=crop%2Cresize
Asus’ RTX 5070 Ti-equipped ROG Zephyrus G14 gaming laptop is $350 off,"If you’re looking for a discount on the best gaming laptop out there, Best Buy has it. The ROG G14 with the AMD Ryzen AI 9 HX 370 processor is $2,049.99.",https://www.theverge.com/tech/713731/asus-rog-g14-zephyrus-gaming-laptop-5070ti-deal-sale,2025-07-25T14:29:51Z,The Verge,https://platform.theverge.com/wp-content/uploads/sites/2/2025/07/vergedealsROGG14.png?quality=90&strip=all&crop=0%2C10.732984293194%2C100%2C78.534031413613&w=1200
"Bigg Boss 19 First Look Out: Makers Unveil Bold New Eye Design, Promise More Drama","Bigg Boss 19 reveals a bold new eye design, with AI integration and contestant-driven evictions. Expect chaos and drama. Premieres August 2025.",https://www.news18.com/movies/television/bigg-boss-19-first-look-out-makers-unveil-bold-new-eye-design-promise-more-drama-ws-l-9463911.html,2025-07-25T13:38:26Z,News18,https://images.news18.com/ibnlive/uploads/2025/07/Untitled-design-2025-07-25T190645.628-2025-07-a5d7d88824ffd6c83ec3ca4249a91bf0-16x9.png
"Nishijinori weaving meets AI, a new era for Kyoto's kimonos","Nishijinori, the intricate weaving for kimonos that dates back more than a thousand years in Japan's ancient capital of Kyoto, is getting a modern-day high-tech collaborator: artificial intelligence.",https://apnews.com/article/japan-kyoto-ai-nishijinori-tradition-kimono-6c95395a5197ce3dd97b87afa6ac5cc7,2025-07-25T12:44:13Z,The Associated Press,https://dims.apnews.com/dims4/default/4bc0314/2147483647/strip/true/crop/5000x2813+0+260/resize/1440x810!/quality/90/?url=https%3A%2F%2Fassets.apnews.com%2F55%2F5d%2F0ba2cc52a33ab2cdd21dfca30e50%2Ff94d244d4ee9424c8258f689390b9ed4
"Pakistan advances ""Digital Nation"" vision with AI partnerships","Islamabad: Federal Minister Shaza Fatima Khawaja recently met with a delegation from Arizona State University and the National Institute of Technology, where she received a briefing on bilateral collaboration in Artificial Intelligence (AI) and advanced technology.",https://www.bolnews.com/latest/2025/07/pakistan-advances-digital-nation-vision-with-ai-partnerships/,2025-07-25T10:05:33Z,BOL News,https://www.bolnews.com/wp-content/uploads/2025/07/ekosistem-startup-pakistan-berkembang.jpg.webp
GPD’s monster Strix Halo handheld requires a battery ‘backpack’ or a 180W charger,"The GPD Win 5 will house the Ryzen AI Max+ 395 chip, with AMD’s most powerful integrated graphics, inside a PlayStation Vita-shaped machine.",https://www.theverge.com/news/714294/gpd-win-5-strix-halo-specs-revealed,2025-07-25T23:19:12Z,The Verge,https://platform.theverge.com/wp-content/uploads/sites/2/2025/07/vlcsnap-2025-07-25-09h10m39s214.png?quality=90&strip=all&crop=0%2C3.4613147178592%2C100%2C93.077370564282&w=1200
What if Clippy and AI Cloud intelligence had a baby? It would probably look like Microsoft's new Copilot Appearance feature,"Microsoft is giving Copilot a smile, but that doesn't mean it will laugh at your jokes",https://www.techradar.com/ai-platforms-assistants/what-if-clippy-and-ai-cloud-intelligence-had-a-baby-it-would-probably-look-like-microsofts-new-copilot-appearance-feature,2025-07-25T23:00:00Z,TechRadar,https://cdn.mos.cms.futurecdn.net/6bLKPCpj4GZeYNYXnmR8GN.png
B.C. man files class action against Amazon for Alexa data collection,B.C. Supreme Court proposed class action against Amazon claims privacy breaches and the retention of data to train AI.,https://www.vancouverisawesome.com/bc-news/bc-man-files-class-action-against-amazon-for-alexa-data-collection-10989437,2025-07-25T22:31:53Z,Vancouver Is Awesome,https://www.vmcdn.ca/f/files/glaciermedia/images/getty-images/echodotdevicealexa.jpg;w=1200;h=800;mode=crop
King Gizzard and the Lizard Wizard Pulls Music Off Spotify,"King Gizzard & the Lizard Wizard pulled their music off Spotify, citing CEO Daniel Ek's investment in 'AI military drone technology.'",https://variety.com/2025/music/news/king-gizzard-and-the-lizard-wizard-pulls-music-off-spotify-1236470802/,2025-07-25T20:34:28Z,Variety,https://variety.com/wp-content/uploads/2025/07/KGLW_PhotoCredit_MaclayHeriot.jpg?w=1000&h=563&crop=1
Switched to ChatGPT for search? Google wants to tempt you back with Web Guide - here’s how to try it,AI search comes in many flavors,https://www.techradar.com/ai-platforms-assistants/switched-to-chatgpt-for-search-google-wants-to-tempt-you-back-with-web-guide-heres-how-to-try-it,2025-07-25T20:00:00Z,TechRadar,https://cdn.mos.cms.futurecdn.net/RudaT5Ksvv6TchPN2H7hxD.png
"After Kiss Cam Chaos, Astronomer Hires Chris Martin’s Ex-Wife Gwyneth Paltrow: ‘What A Savage Move’","Astronomer names Gwyneth Paltrow as temporary spokesperson amid scandal, humorously addressing data operations, AI products, and upcoming conference.",https://www.news18.com/viral/after-kiss-cam-chaos-astronomer-hires-chris-martins-ex-wife-gwyneth-paltrow-what-a-savage-move-ws-l-aa-aa-9464740.html,2025-07-26T04:51:03Z,News18,https://images.news18.com/ibnlive/uploads/2025/07/DYK-Snakes-and-Ladders-was-originated-in-India-2025-07-26T101449.231-2025-07-9b1f41ef66ae478973a4951a266fdfaf-16x9.png
"1,200 more drivers caught out by new Midlands 'smart' AI speed cameras",The cameras used advance technology to help them catch speeding motorists,https://www.birminghammail.co.uk/black-country/1200-more-drivers-caught-out-32119343,2025-07-26T04:39:00Z,Birmingham Live,https://i2-prod.birminghammail.co.uk/article31534047.ece/ALTERNATES/s1200/0_PAS_STO_291223sc_002.jpg
Are AI tools making you forgetful and dull? Here’s how to prevent a brain burnout,"If you don’t go to the gym long enough, your muscles will weaken. Similarly, when we stop pushing our brains, they become less resilient",https://indianexpress.com/article/health-wellness/ai-tools-forgetful-dull-prevent-brain-burnout-10150552/,2025-07-26T04:33:12Z,The Indian Express,https://images.indianexpress.com/2025/07/ai-tools.jpg
Who Needs Mars? AI Video Shows NASA Testing Rover On Mira Road’s Crater-Like Streets,"A viral AI video humorously shows NASA scientists testing the Mars Rover on Mira Road's pothole-filled streets in Mumbai, highlighting the area's road issues.",https://www.news18.com/viral/who-needs-mars-nasa-is-testing-mars-rover-on-mira-roads-crater-like-streets-ws-l-aa-aa-aa-aa-aa-9464634.html,2025-07-26T04:05:57Z,News18,https://images.news18.com/ibnlive/uploads/2025/07/DYK-Snakes-and-Ladders-was-originated-in-India-2025-07-26T092635.382-2025-07-f3e9d664a9f0127acaf1911e05cd611d-16x9.png
Gurugram teen’s device helps patients speak,"Pranet Khetan, a Class 11 student at Shiv Nadar School, used AI and machine learning to develop the prototype and database for the Hindi-language ASR he named ‘Paraspeak’",https://theprint.in/feature/gurugram-prenet-khetan-ai-device-hindi/2702631/,2025-07-26T03:39:53Z,ThePrint,https://static.theprint.in/wp-content/uploads/2025/07/feature-image-2025-07-25T204453.709.jpg
Study reveals stigmatizing responses in LLMs for addiction-related queries,"As artificial intelligence is rapidly developing and becoming a growing presence in healthcare communication, a new study addresses a concern that large language models (LLMs) can reinforce harmful stereotypes by using stigmatizing language.",https://www.news-medical.net/news/20250726/Study-reveals-stigmatizing-responses-in-LLMs-for-addiction-related-queries.aspx,2025-07-26T04:30:00Z,News-Medical.net,https://www.news-medical.net/image-handler/picture/2018/7/Selection_of_alcoholic_drinks_on_rustic_wood_background_-_Oleksandra_Naumenko_A1_fe979bdaef3943969b200bceaf42b174-620x480.jpg
How Lovable became a successful AI-powered app builder,"Lovable, a Swedish AI startup, has surpassed $100 million in annual recurring revenue with over 2.3 million active users. Discover its journey of democratizing app development through innovative tools like GPT Engineer, enabling non-coders to create seamlessly.",https://indianexpress.com/article/explained/explained-sci-tech/lovable-ai-powered-app-builder-10151429/,2025-07-26T12:09:19Z,The Indian Express,https://images.indianexpress.com/2025/07/lovable-.jpg
AI&US-‘It’s the most empathetic voice in my life’: How AI is transforming the lives of neurodivergent people,"However, since 2022, D’hotman has been a regular user of ChatGPT, the popular AI-powered chatbot from OpenAI, relying on it to overcome communication barriers at work and in her personal life.",https://www.devdiscourse.com/article/technology/3517923-aius-its-the-most-empathetic-voice-in-my-life-how-ai-is-transforming-the-lives-of-neurodivergent-people,2025-07-26T10:03:56Z,Devdiscourse,https://www.devdiscourse.com/remote.axd?https://devdiscourse.blob.core.windows.net/imagegallery/27_06_2019_18_34_04_2312796.png?width=920&format=jpeg
women using new tech less: study,"Women are using AI significantly less then men and it’s going to have a major impact on their careers, according to extensive research on the topic.",https://www.cp24.com/news/world/2025/07/26/women-are-using-ai-less-in-the-workplace-harvard-study-suggests/,2025-07-26T09:00:00Z,CP24 Toronto,https://www.cp24.com/resizer/v2/AP53EZOOPYU726VFNGQGI6OWVM.jpg?smart=true&auth=c1a0bc45dc504a855f4c053288fc4d6d91e7a47bd0bae759d8432160308767c6&width=1200&height=630
Aniruddhacharya Apologises For Saying ‘Unmarried Women Have Loose Character’ | Video Made By AI?,A video shows Swami Aniruddhacharya saying that 25-year-old unmarried women have loose character. He also suggested that girls should be married at the age of 14.,https://www.news18.com/viral/was-aniruddhacharya-video-saying-unmarried-women-have-loose-character-made-by-ai-aa-9465189.html,2025-07-26T07:49:20Z,News18,https://images.news18.com/ibnlive/uploads/2025/07/image-by-nvnbhanwala-naveen-bhanwala-2025-07-972eeb3150b161a7f8aa6ed50d198fc4-16x9.jpg
‘Best Use Of AI’: Delhi School Helps Students Experience Their Dream Careers,"Delhi's Sapphire International School uses AI to turn students' dream careers into lifelike projections, capturing their reactions and winning hearts on social media.",https://www.news18.com/viral/aspire-to-be-a-doctor-delhi-school-uses-ai-to-show-students-living-dream-jobs-ws-l-aa-aa-9464999.html,2025-07-26T06:38:57Z,News18,https://images.news18.com/ibnlive/uploads/2025/07/DYK-Snakes-and-Ladders-was-originated-in-India-2025-07-26T120300.987-2025-07-7e8b6822e9ae6a9f52d9adbe163d0ba7-16x9.png
"Tape achieves record shipments once again, but its affordability is fading with LTO-10’s high cost per terabyte",The storage format is seeing strong demand off the back of AI,https://www.techradar.com/pro/tape-is-not-dead-yet-but-usd300-lto-10-cartridges-and-inflated-exabyte-numbers-wont-help-its-cause,2025-07-26T17:32:00Z,TechRadar,https://cdn.mos.cms.futurecdn.net/Cg4dWzrEphf3amA7s47YCj.jpg
"Building AI literacy, innovation in PH","EARLIER in June, amid rising momentum in AI adoption, we launched the Philippine edition of our National AI Prompt Design Challenge, now in its final judging stage.",https://www.manilatimes.net/2025/07/27/business/sunday-business-it/building-ai-literacy-innovation-in-ph/2156641,2025-07-26T16:12:00Z,The Manila Times,https://www.manilatimes.net/manilatimes/uploads/images/2025/07/26/690706.png
DOGE AI Tool to Target 100K Federal Rules for Elimination: Report,The reported plan represents one of the most aggressive attempts by the Trump administration to overhaul the federal regulatory system.,https://www.newsweek.com/trump-administration-ai-regulations-cut-doge-2104483,2025-07-26T16:03:06Z,Newsweek,https://d.newsweek.com/en/full/2690817/us-capitol-building.jpg
BPO employees hold pre-SONA protest,"THE Business Process Outsourcing (BPO) Industry Employees Network (BIEN) Philippines on Saturday held its annual protest action to demand higher wages, disaster protection and artificial intelligence (AI) regulation on the eve of President Ferdinand Marcos Jr.’s fourth State of the Nation Address (SONA).",https://www.manilatimes.net/2025/07/27/news/national/bpo-employees-hold-pre-sona-protest/2156705,2025-07-26T16:02:00Z,The Manila Times,https://cdn4.premiumread.com/?url=https://www.manilatimes.net/theme_manilatimes/images/TMT_1920x1008.jpg&w=1920&q=100&f=webp&v=1
American Airlines CEO says using AI to set fares is a ‘bait and switch’ move,"American Airlines’ top executive blasted the use of artificial intelligence in setting air fares, calling the practice inappropriate because it could trick...",https://www.dallasnews.com/business/airlines/2025/07/25/american-airlines-ceo-says-using-ai-to-set-fares-is-a-bait-and-switch-move/,2025-07-25T14:26:02Z,The Dallas Morning News,https://dmn-dallas-news-prod.cdn.arcpublishing.com/resizer/v2/VHSFYUUCSFDDPRZX3LGAFHEWYE.jpg?auth=4d2830b5a495a3120bea2c3d8eb584016e8f70d115ae9c735af487c74d15e866&quality=80&width=1200&height=630&smart=true
Meta names ChatGPT co-creator as AI lab's chief scientist,Zhao was part of the team behind the original version of OpenAI's popular ChatGPT chatbot before joining Meta.,https://www.wltx.com/article/news/nation-world/meta-names-chatgpt-co-creator-ai-labs-chief-scientist/507-e697e18d-923e-45f2-9ee2-464bdbc1c8e7,2025-07-25T23:11:34Z,WLTX.com,https://media.wltx.com/assets/CCT/images/be390988-fad5-4700-b032-4e07e609c893/20250313T132613/be390988-fad5-4700-b032-4e07e609c893_1140x641.jpg
"Hickenlooper, bipartisan colleagues demand answers about Grok’s antisemitic language on X",WASHINGTON D.C. (KRDO) -- Colorado Senator John Hickenlooper has joined 15 other Senators to demand answers from Elon Musk's xAI about its chatbot,https://krdo.com/news/2025/07/25/hickenlooper-bipartisan-colleagues-demand-answers-about-groks-antisemitic-language-on-x/,2025-07-25T17:03:44Z,KRDO,https://krdo.b-cdn.net/2025/07/Untitled-design-2025-07-25T104933.973.jpg
I use Claude every day - this single prompt makes a huge difference,"Claude AI is a fantastic chatbot, and this is the method I use to prompt for it",https://www.tomsguide.com/ai/i-use-claude-every-day-this-is-the-single-prompt-that-will-make-a-huge-difference,2025-07-25T06:01:00Z,Tom's Guide,https://cdn.mos.cms.futurecdn.net/p9Axgx8Fenpfd4CY53Y86F.jpg
"Global Headlines Shuffle: Loss, Diplomacy, and Market Moves","Recent global news includes COVID-19 envoy David Nabarro passing away at 75, China proposing a global AI cooperation body, and Trump's visit to Scotland for golf and EU trade negotiations. Ukraine's drone disruption in Russia, protests in Malaysia, and a U.S. ceasefire effort between Thailand and Cambodia also featured prominently.",https://www.devdiscourse.com/article/law-order/3518534-global-headlines-shuffle-loss-diplomacy-and-market-moves,2025-07-26T23:53:48Z,Devdiscourse,https://www.devdiscourse.com/remote.axd?https://devdiscourse.blob.core.windows.net/aiimagegallery/24_06_2025_13_01_24_6491762.png?width=920&format=jpeg
High Bandwidth Flash backed by computing legends as Sandisk aims to build cheaper AI memory platform,NAND-based HBF offers HBM-class bandwidth with up to 4TB capacity,https://www.techradar.com/pro/sandisk-recruits-risc-cofounder-amd-graphics-legend-to-spearhead-cheaper-rival-to-hbm-high-bandwidth-flash-could-bring-ssd-capacities-to-ai-gpus-without-the-cost,2025-07-26T22:04:00Z,TechRadar,https://cdn.mos.cms.futurecdn.net/Y9YMmwwBHdmcfxPbEZnwJe.jpg
