title,description,url,publishedAt,source,image
Mark Zuckerberg’s secret list of top AI talent to poach has tech world atwitter,"Meta CEO reportedly to offer pay packages worth up to $100m, a gambit OpenAI’s Sam Altman calls ‘crazy’",https://www.theguardian.com/us-news/2025/jun/28/mark-zuckerberg-ai-list,2025-06-28T19:38:10Z,The Guardian,https://i.guim.co.uk/img/media/5d9a02fba4401d77d617662a647ca9d607e1ac60/411_0_5079_4063/master/5079.jpg?width=1200&height=630&quality=85&auto=format&fit=crop&overlay-align=bottom%2Cleft&overlay-width=100p&overlay-base64=L2ltZy9zdGF0aWMvb3ZlcmxheXMvdGctZGVmYXVsdC5wbmc&enable=upscale&s=ccb7f129414bb630f2dfb2860d7283cf
What would Nottingham look like in a world ran by AI? The major film asking that question,The Correction Unit has been a few years in the making but it looks very very interesting,https://www.nottinghampost.com/whats-on/whats-on-news/what-would-nottingham-look-like-10287678,2025-06-29T03:00:00Z,Nottinghamshire Live,https://i2-prod.nottinghampost.com/incoming/article10292984.ece/ALTERNATES/s1200/0_AVC_3132.png
"Small form GMKtec EVO T1 packs 14-core CPU, 128GB RAM, fast AI processing, and four display outputs in one unit",Mini PC EVO T1 delivers desktop-class AI performance,https://www.techradar.com/pro/seriously-who-needs-desktop-pcs-when-this-mini-pc-packs-such-a-powerful-punch-core-ultra-9-285h-three-ssds-two-lan-ports-oculink-port-and-up-to-128gb-ram,2025-06-29T11:28:00Z,TechRadar,https://cdn.mos.cms.futurecdn.net/9cHU2na7d7Evv2fbH6aToP.jpg
Two crises. One message. Only one rang true,"In an age where AI tools can churn out polished boilerplate in seconds, we’ve grown more tolerant of prepackaged language.",https://www.thestar.com/opinion/contributors/two-crises-one-message-only-one-rang-true-in-crisis-management-words-matter--/article_4afa2b92-c966-4ac2-8f57-7ab2e1fe080c.html,2025-06-29T10:00:00Z,Toronto Star,https://bloximages.chicago2.vip.townnews.com/thestar.com/content/tncms/assets/v3/editorial/e/ba/ebace4c2-fc36-58c7-9014-3ac6a162fc8e/685db54a5cdd5.image.jpg?crop=1763%2C926%2C0%2C124&resize=1200%2C630&order=crop%2Cresize
It’s true that my fellow students are embracing AI - but this is what the critics aren’t seeing,"Those turning to ChatGPT aren’t lazy. My generation has found itself stranded in a rapidly changing and, since Covid, badly mishandled education system, says student Elsie McDowell",https://www.theguardian.com/commentisfree/2025/jun/29/students-ai-critics-chatgpt-covid-education-system,2025-06-29T07:00:47Z,The Guardian,https://i.guim.co.uk/img/media/4646fd977df9ba349d8e32ad9dca82ffad518c01/218_0_3500_2800/master/3500.jpg?width=1200&height=630&quality=85&auto=format&fit=crop&overlay-align=bottom%2Cleft&overlay-width=100p&overlay-base64=L2ltZy9zdGF0aWMvb3ZlcmxheXMvdGctb3BpbmlvbnMucG5n&enable=upscale&s=b3e65fcea5cf997e733568a026f1a9f4
"As Reddit Celebrates Its 20th Anniversary, It Embraces AI To Evolve - But Fights To Stay Human As Google And Chatbots Try To Strip Away Its Soul",Reddit marks its 20th anniversary and shares about its plans to focus on AI while keeping the core,https://wccftech.com/as-reddit-turns-20-it-embraces-ai-to-evolve-but-fights-to-stay-human-as-google-and-chatbots-try-to-strip-away-its-soul/,2025-06-29T05:48:48Z,Wccftech,https://cdn.wccftech.com/wp-content/uploads/2025/06/Reddit-e1751174796485.jpg
"This isn't Dell, but the Colorful Smart 900 mini PC gives off serious Alienware vibes and runs Ryzen’s top AI Max+ chip",Colorful's Smart 900 is yet another Strix Halo device from a smaller brand,https://www.techradar.com/pro/no-dell-didnt-launch-an-alienware-mini-pc-but-this-ryzen-ai-max-395-powered-pc-looks-a-lot-like-one-and-it-can-even-read-sd-4-0-cards,2025-06-29T15:02:00Z,TechRadar,https://cdn.mos.cms.futurecdn.net/MESWACsN8D5vEn3N2tSrgB.jpg
Hollywood’s pivot to AI video has a prompting problem,Asteria co-founder Bryn Mooser is trying to prove that the entertainment industry can embrace generative AI;.,https://www.theverge.com/ai-artificial-intelligence/694687/asteria-bryn-mooser-uncanny-valley-gen-ai,2025-06-29T15:00:00Z,The Verge,https://platform.theverge.com/wp-content/uploads/sites/2/2025/06/257666_futureproofing_film.jpg?quality=90&strip=all&crop=0%2C10.726323221827%2C100%2C78.547353556346&w=1200
The unbearable obviousness of AI fitness summaries,"I’ve been testing AI fitness and health summaries across platforms like Whoop, Oura, and Strava. The results often repackage obvious stats and advice.",https://www.theverge.com/fitness-trackers/694140/ai-summaries-fitness-apps-strava-oura-whoop-wearables,2025-06-29T14:00:00Z,The Verge,https://platform.theverge.com/wp-content/uploads/sites/2/2025/06/257829_AI_fitness_summaries_CVirginia2.jpg?quality=90&strip=all&crop=0%2C10.732984293194%2C100%2C78.534031413613&w=1200
China’s robot matches create excitement,"While China’s men’s soccer team hasn’t generated much excitement in recent years, humanoid robot teams have won over fans in Beijing based more on the AI technology involved than any athletic prowess shown.",https://www.cp24.com/news/world/2025/06/29/chinas-humanoid-robots-generate-more-soccer-excitement-than-their-human-counterparts/,2025-06-29T13:20:06Z,CP24 Toronto,https://www.cp24.com/resizer/v2/MVNWVLINOGFJBXDN23W3S5N4ME.jpg?smart=true&auth=612f9ef8a1a6bacea343a062dc4e02609b61015daec4072415f34a3b28a24932&width=1200&height=630
'Future-proof policing' the theme for local gathering of police chiefs,"Recruitment challenges, AI, tech, and healthy workplaces all part of this year's Ontario Association of Chiefs of Police conference",https://www.bradfordtoday.ca/local-news/future-proof-policing-the-theme-for-local-gathering-of-police-chiefs-10860601,2025-06-29T21:00:00Z,BradfordToday,https://www.vmcdn.ca/f/files/collingwoodtoday/images/premier-addressing-delegates.jpg;w=1200;h=800;mode=crop
Major Wimbledon change as iconic feature of tournament will be MISSING for first time in its 148 year history,LINE judges will be absent from Wimbledon today for the first time in the tournament’s 148-year history — after being booted out by AI.Around 300,https://www.thesun.ie/sport/15457140/wimbledon-tournament-tennis-change-no-line-judges/,2025-06-29T19:24:00Z,The Irish Sun,https://www.thesun.ie/wp-content/uploads/sites/3/2025/06/wimbledon-logo-seen-led-screen-1005749890.jpg?strip=all&quality=100&w=1920&h=1080&crop=1
"The economic reform round table should discuss AI and robots, not just tax and productivity",The economic reform round table set down for August will talk about tax reform but a strategy for the future of artificial intelligence and robots should be part of the conversation.,https://www.abc.net.au/news/2025-06-30/economic-reform-round-table-tax-productivity-ai-robots-kohler/105473930,2025-06-29T18:59:53Z,ABC News,https://live-production.wcms.abc-cdn.net.au/e724c2b0d675d07e091743b1746f3f0e?impolicy=wcms_watermark_news&cropH=489&cropW=870&xPos=0&yPos=0&width=862&height=485&imformat=generic
"Don't Ask AI ChatBots for Medical Advice, Study Warns","""Millions of people are turning to AI tools for guidance on health-related questions,"" said Natansh Modi of the University of South Africa.",https://www.newsweek.com/ai-chatbot-medical-health-advice-warning-study-2091535,2025-06-29T14:30:01Z,Newsweek,https://d.newsweek.com/en/full/2672649/stock-image-sick-person.jpg
Disturbing Signs of AI Threatening People Spark Concern,"The world's most advanced AI models are exhibiting troubling new behaviors – lying, scheming, and even threatening their creators to achieve their goals.",https://www.sciencealert.com/disturbing-signs-of-ai-threatening-people-spark-concern,2025-06-30T02:33:06Z,ScienceAlert,https://www.sciencealert.com/images/2023/12/BrightBlueFilamentsInDarkness.jpg
Xiaomi’s new AI glasses are already giving Ray-Ban Metas a serious beatdown,Xiaomi’s new smart glasses last twice as long as Ray-Ban Meta’s.,https://www.androidcentral.com/gaming/virtual-reality/xiaomis-new-ai-glasses-are-already-giving-ray-ban-metas-a-serious-beatdown,2025-06-30T00:53:22Z,Android Central,https://cdn.mos.cms.futurecdn.net/xcF2JjADtNF7tgFAFcb3Ko.jpg
Spotify’s latest breakout band The Velvet Sundown appears to be AI-generated - and fans aren’t happy,It’s either AI or a very clever marketing campaign,https://www.techradar.com/computing/artificial-intelligence/spotifys-latest-breakout-band-the-velvet-sundown-appears-to-be-ai-generated-and-fans-arent-happy,2025-06-30T12:09:32Z,TechRadar,https://cdn.mos.cms.futurecdn.net/EsT5mNnqovwwizCBuZZj9.jpg
AI helps save swimmer’s life after suffering medical episode at Stirling Leisure in Inglewood,Incredible artificial intelligence that watches over swimmers at a Perth pool has potentially helped save a life after alerting lifeguards to a man in danger.,https://www.perthnow.com.au/wa/perth/ai-helps-save-swimmers-life-after-suffering-medical-episode-at-stirling-leisure-in-inglewood--c-19202058,2025-06-30T10:05:00Z,PerthNow,https://images.perthnow.com.au/publication/C-19202058/18be1630b0dae449ae76dcd62ca8de27c9029ffb-16x9-x272y0w1875h1055.jpg?imwidth=1200
Why Manhattan Associates is Not Developing AI Agents for Its Clients,"Manhattan maintains a strong partnership with Google, hosting its solutions on Google Cloud and leveraging Google’s AI infrastructure.",https://analyticsindiamag.com/gcc/why-manhattan-associates-is-not-developing-ai-agents-for-its-clients/,2025-06-30T08:42:34Z,Analytics India Magazine,https://analyticsindiamag.com/wp-content/uploads/2025/06/Shalini_-Why-Manhattan-Associates-is-not-Developing-AI-Agents-for-its-clients.jpg
"CJ ENM Unveils AI Strategy Inc Animation 'Cat Biggie' & Film, Drama Push",CJ ENM has unveiled its AI strategy alongside AI-generated animation 'Cat Biggie' and plans to push into AI film and drama.,https://deadline.com/2025/06/cj-enm-unveils-ai-strategy-cat-biggie-film-drama-1236445561/,2025-06-30T07:39:24Z,Deadline,https://deadline.com/wp-content/uploads/2025/06/Cat-Biggie_1-CJ-ENM.jpeg?w=1024
Market Factors: 11 ways the market’s acting weird,"Plus, GARP stock buying opportunities in AI",https://www.theglobeandmail.com/investing/investment-ideas/article-market-factors-11-ways-the-markets-acting-weird/,2025-06-30T17:48:39Z,The Globe and Mail,https://www.theglobeandmail.com/pf/resources/assets/meta/facebook-1200x630.png?d=717
"The future of web building: AI has huge potential, but humans remain indispensable, says Wix COO","I spoke with Ronny Elkayam, COO of Wix, to get his thoughts on the future of the web and what opportunities it will present",https://www.techradar.com/pro/website-building/sorry-ai-when-dealing-with-culture-ethics-and-people-you-need-human-oversight-according-to-wix-coo,2025-06-30T15:18:59Z,TechRadar,https://cdn.mos.cms.futurecdn.net/Qt9mpaZJ3MKQbjUBXmdJwD.png
Microsoft says AI system better than doctors at diagnosing complex health conditions,Firm says results of research create ‘path to medical superintelligence’ but plays down job implications,https://www.theguardian.com/technology/2025/jun/30/microsoft-ai-system-better-doctors-diagnosing-health-conditions-research,2025-06-30T14:00:44Z,The Guardian,https://i.guim.co.uk/img/media/18e3dee252c32de954c935e3e1925bf6f7e69372/1362_0_6830_5464/master/6830.jpg?width=1200&height=630&quality=85&auto=format&fit=crop&overlay-align=bottom%2Cleft&overlay-width=100p&overlay-base64=L2ltZy9zdGF0aWMvb3ZlcmxheXMvdGctZGVmYXVsdC5wbmc&enable=upscale&s=d06a0f645206937e56d7520d4b6709a7
"Apple In Talks With Anthropic And OpenAI To Supercharge Siri, Aiming To Deliver Advanced AI Features While It Continues Work On Its Own Models",Apple is said to be partnering up with OpenAI or Anthropic for integrating its LLM models into Siri for advancement,https://wccftech.com/apple-in-talks-with-anthropic-and-openai-to-supercharge-siri-aiming-to-deliver-advanced-ai-features-while-it-continues-work-on-its-own-models/,2025-06-30T23:16:18Z,Wccftech,https://cdn.wccftech.com/wp-content/uploads/2025/06/Siri-1.jpg
Alibaba unveils upgraded Qwen VLo model with image generation capabilities: How it works,"Alibaba Group has launched Qwen VLo, an upgraded AI system that enhances image generation and editing capabilities. This multimodal model allows users to create and modify visuals through text prompts.",https://www.livemint.com/technology/tech-news/alibaba-unveils-upgraded-qwen-vlo-model-with-image-generation-capabilities-how-it-works-11751301598274.html,2025-06-30T22:13:38Z,Livemint,https://www.livemint.com/lm-img/img/2025/06/30/1600x900/ALIBABA-AI--0_1751301675174_1751301684186.JPG
Did Mark Zuckerberg's Meta really offer $100 million to lure OpenAI talent? Lucas Beyer responds…,"Lucas Beyer, an AI researcher, confirmed his move from OpenAI to Meta, denying claims of a $100 million signing bonus. Alongside him, colleagues Kolesnikov and Zhai will join Meta, highlighting competition for AI talent among tech giants amid Meta's strategic push in superintelligence research.",https://www.livemint.com/technology/tech-news/ai-researcher-lucas-beyer-refutes-sam-altmans-100m-bonus-claim-from-meta-after-leaving-openai-11751297587139.html,2025-06-30T21:38:42Z,Livemint,https://www.livemint.com/lm-img/img/2025/06/30/1600x900/US-OPENAI-CEO-SAM-ALTMAN-TESTIFIES-IN-SENATE-COMME_1751299350530_1751299350809.jpg
"Samsung's $1,599 Smart Monitor M9 sounds amazing, but this OLED AI beast may be an overkill for your desk",Samsung’s flashy 32-inch M9 monitor mixes AI with entertainment,https://www.techradar.com/pro/samsung-just-launched-a-new-32-inch-4k-smart-oled-monitor-with-ai-and-microsoft-365-access-but-why-is-it-so-bloody-expensive,2025-06-30T20:31:00Z,TechRadar,https://cdn.mos.cms.futurecdn.net/LBV7mY6xUCFXJpXjsiuZHH.png
Apple weighs using Anthropic or OpenAI to power Siri in major reversal,A switch to Anthropic’s Claude or OpenAI’s ChatGPT models for Siri would be an acknowledgment that the company is struggling to compete in generative AI.,https://www.afr.com/technology/apple-weighs-using-anthropic-or-openai-to-power-siri-in-major-reversal-20250701-p5mbia,2025-06-30T20:18:21Z,The Australian Financial Review,https://static.ffx.io/images/$zoom_0.6797%2C$multiply_2%2C$ratio_1.777778%2C$width_1059%2C$x_273%2C$y_121/t_crop_custom/c_scale%2Cw_800%2Cq_88%2Cf_jpg/t_afr_no_label_no_age_social_wm/b393d154aa3e5f28f98125fa4bc37f7e391e50bf
AI tool matches doctors in accurately outlining lung tumors on CT scans,"In radiation therapy, precision can save lives. Oncologists must carefully map the size and location of a tumor before delivering high-dose radiation to destroy cancer cells while sparing healthy tissue.",https://www.news-medical.net/news/20250701/AI-tool-matches-doctors-in-accurately-outlining-lung-tumors-on-CT-scans.aspx,2025-07-01T04:12:00Z,News-Medical.net,https://www.news-medical.net/image-handler/picture/2014/7/Radiation_Therapy-620x480.jpg
Opinion: Gen Z is struggling to find work,"Today’s youth are navigating a perfect storm of persistent inflation, global trade tensions, a saturated labour market and restructuring driven by automation and AI.",https://www.vancouverisawesome.com/highlights/opinion-gen-z-is-struggling-to-find-work-10883795,2025-07-01T01:00:00Z,Vancouver Is Awesome,https://www.vmcdn.ca/f/files/glaciermedia/images/getty-images/universitygraduategetty.jpg;w=1200;h=800;mode=crop
Caltech researchers develop safer and smarter breast imaging technique,"A Caltech-led team has developed a safe, effective, and painless breast imaging technique that incorporates machine learning to help differentiate between suspicious and healthy tissue.",https://www.news-medical.net/news/20250630/Caltech-researchers-develop-safer-and-smarter-breast-imaging-technique.aspx,2025-07-01T03:54:00Z,News-Medical.net,https://www.news-medical.net/image-handler/picture/2014/7/Magnetic_Resonance_Imaging-620x480.jpg
"ChatGPT could pilot a spacecraft shockingly well, early tests find","In a recent contest, teams of researchers competed to see who could train an AI model to best pilot a spaceship. The results suggest that an era of autonomous space exploration may be closer than we think.",https://www.livescience.com/space/space-exploration/chatgpt-could-pilot-a-spacecraft-shockingly-well-early-tests-find,2025-07-01T12:00:00Z,Livescience.com,https://cdn.mos.cms.futurecdn.net/oJfonXvKSxMU53ZWTkdNg4.jpg
"Mark Zuckerberg announces Meta Superintelligence Labs — with a battalion of AI gurus poached from OpenAI, Google, and DeepMind to try and secure an AGI win",Mark Zuckerberg recently shared an internal memo announcing Meta Superintelligence Labs as he plays catch-up with OpenAI and Google in the AI race.,https://www.windowscentral.com/software-apps/mark-zuckerberg-announces-meta-superintelligence-labs,2025-07-01T10:00:00Z,Windows Central,https://cdn.mos.cms.futurecdn.net/F9EwN3LFieQGLnZ7ypdUmJ.jpg
"Publishers, website owners to block AI ‘crawlers’ that don’t pay",Websites will find it easier to lock out bots from AI companies like OpenAI and Google that are taking data to train their models without payment or permission.,https://www.afr.com/technology/publishers-website-owners-to-block-ai-crawlers-that-don-t-pay-20250630-p5mbgn,2025-07-01T10:00:00Z,The Australian Financial Review,https://static.ffx.io/images/$zoom_0.3311%2C$multiply_3%2C$ratio_1.777778%2C$width_1059%2C$x_0%2C$y_0/t_crop_custom/c_scale%2Cw_800%2Cq_88%2Cf_jpg/t_afr_no_label_no_age_social_wm/2c101196be0827cbb94fe078158bfda5c5b2ee70189fbbf374350d884edafca6
"Microsoft's new AI can be 4x more accurate and 20% cheaper than human doctors — Mustafa Suleyman calls it ""a genuine step toward medical superintelligence""",Microsoft recently claimed that its new powerful AI-powered tool can diagnose diseases up to four times more accurately than a human doctor.,https://www.windowscentral.com/software-apps/microsoft-new-ai-4x-more-accurate-20-percent-cheaper-than-human-doctors,2025-07-01T09:00:00Z,Windows Central,https://cdn.mos.cms.futurecdn.net/rVU5dSRFyaj6uaVVT8awjc.jpg
Grammarly acquires AI email client Superhuman,"In its announcement, Grammarly said it wants to build AI agents for emails using Superhuman's tech.",https://techcrunch.com/2025/07/01/grammarly-acquires-ai-email-client-superhuman/,2025-07-01T15:25:03Z,TechCrunch,"https://techcrunch.com/wp-content/uploads/2021/11/Grammarly-Abstract.jpg?resize=1200,632"
‘I have a lot of sympathy for Elon Musk’: Succession creator Jesse Armstrong on his tech bros AI satire Mountainhead,"He is the master of ripped-from-the-headlines drama, a writer who skewers the billionaire class. As Mountainhead takes him into new territory, he talks about his nuanced view of the world’s richest man – and why a bonnet drama may be next",https://www.theguardian.com/film/2025/jul/01/mountainhead-jesse-armstrong-intervew-elon-musk-succession-tech-bros-ai,2025-07-01T15:12:51Z,The Guardian,https://i.guim.co.uk/img/media/545a301bd5d347b36446661c22e4250ba488b48c/264_112_759_607/master/759.jpg?width=1200&height=630&quality=85&auto=format&fit=crop&overlay-align=bottom%2Cleft&overlay-width=100p&overlay-base64=L2ltZy9zdGF0aWMvb3ZlcmxheXMvdGctZGVmYXVsdC5wbmc&enable=upscale&s=6f6ffd08c86a9de9d69e20a2845871e4
"🔎 Group C at the Women's EURO, Germany aiming to reclaim their crown","The most physical and balanced group of the tournament brings together a historic champion, two experienced Scandinavian teams, and a hungry debutant. The margin for error will be minimal for those ai...",https://ca.sports.yahoo.com/news/group-c-womens-euro-germany-145000145.html,2025-07-01T14:50:00Z,Yahoo Canada Sports,https://s.yimg.com/ny/api/res/1.2/B0IqW.C_8jjoiEmlHneBnQ--/YXBwaWQ9aGlnaGxhbmRlcjt3PTEyMDA7aD04MDA7Y2Y9d2VicA--/https://media.zenfs.com/en/onefootball_articles_802/ebae25dde6f20e7b3d8dcdeb1343a53e
‘Sign-on bonuses of $150m’: AI talent war heats up,"Senior AI research scientists in Silicon Valley are being lured with far higher remuneration than computer engineers without AI experience, say hiring specialists.",https://www.afr.com/technology/sign-on-bonuses-of-150m-ai-talent-war-heats-up-20250701-p5mbr1,2025-07-01T23:40:38Z,The Australian Financial Review,https://static.ffx.io/images/$zoom_1%2C$multiply_1%2C$ratio_1.777778%2C$width_1059%2C$x_214%2C$y_256/t_crop_custom/c_scale%2Cw_800%2Cq_88%2Cf_jpg/t_afr_no_label_no_age_social_wm/562bdc77ea6d4fb45bcf3abef827cee8d5655782
X opens up to Community Notes written by AI bots,X is going to let developers make “AI Note Writers” that can write Community Notes that can potentially appear on posts.,https://www.theverge.com/news/696210/x-community-notes-ai-note-writers,2025-07-01T21:13:23Z,The Verge,https://platform.theverge.com/wp-content/uploads/sites/2/2025/07/STK160_X_TWITTER_2__A.jpg?quality=90&strip=all&crop=0%2C10.732984293194%2C100%2C78.534031413613&w=1200
Grammarly wants to become an ‘AI productivity platform’,Grammarly plans to acquire the buzzy email app Superhuman and has bigger plans for AI and AI agents.,https://www.theverge.com/news/696056/grammarly-acquires-superhuman-email-app-ai-platform,2025-07-01T18:55:00Z,The Verge,https://platform.theverge.com/wp-content/uploads/sites/2/2025/07/Sumac_Blog-Image_ConsumerTech_1520x800_Consumer-Tech.png?quality=90&strip=all&crop=0%2C0.32387526063625%2C100%2C99.352249478728&w=1200
3 reasons why I appreciate AI and maybe you should too,Artificial intelligence with real impact,https://www.techradar.com/computing/artificial-intelligence/3-reasons-why-i-appreciate-ai-and-maybe-you-should-too,2025-07-02T04:01:00Z,TechRadar,https://cdn.mos.cms.futurecdn.net/8PUxwC4hX4bc3YwLSGjQcY.jpg
'Smell detectors' could be used to catch drug abuse - both inside and outside of prison,A smell detector which uses synthetic brain cells and artificial intelligence could improve staff safety in prisons and probation officers and also help detect if an offender in the community has breached their licence conditions.,https://news.sky.com/story/smell-detectors-could-be-used-to-catch-drug-abuse-both-inside-and-outside-of-prison-13391235,2025-07-02T04:00:00Z,Sky News,https://e3.365dm.com/25/05/1600x900/skynews-police-car-police-tape_6916669.jpg?20250514222100
Optibrium partners with TalTech on EU-funded PhD program to advance sustainable drug discovery,"Optibrium, a leading developer of software and AI solutions for molecular design, today announced its partnership with TalTech (Tallinn University of Technology) to co-supervise an EU-funded PhD position as part of the INNOCHEMBIO programme.",https://www.news-medical.net/news/20250702/Optibrium-partners-with-TalTech-on-EU-funded-PhD-program-to-advance-sustainable-drug-discovery.aspx,2025-07-02T11:18:00Z,News-Medical.net,https://www.news-medical.net/image-handler/picture/2019/5/Drug_use_and_prohibited_substances._-_Image_-_Monika_Gruszewicz_A1_b3acfd6d2daf44ecbd36979af20eb378-620x480.jpg
"WhatsApp will now let big businesses voice call you directly, also adds more AI agents",WhatsApp Business users will be seeing some big changes,https://www.techradar.com/pro/whatsapp-will-now-let-big-businesses-voice-call-you-directly-also-adds-more-ai-agents,2025-07-02T09:29:24Z,TechRadar,https://cdn.mos.cms.futurecdn.net/NrgjtG4sSniHuTmjvBcXE5.jpg
Is AI making us dumb?,Are generative AI programs like ChatGPT eroding our critical thinking skills?,https://www.theglobeandmail.com/podcasts/the-decibel/article-artifical-intelligence-generative-ai-chatgpt-gemini-school/,2025-07-02T09:00:00Z,The Globe and Mail,https://www.theglobeandmail.com/resizer/v2/GHQ5WM2SKJDSDH53LMIWUHHUSA.png?auth=b955be5686ba3bba22b7f430e6d099999103d124e5a344f3bf32aace9165d476&width=1200&height=800&quality=80&smart=true
‘AI doesn’t know what an orgasm sounds like’: audiobook actors grapple with the rise of robot narrators,"As demand for audio content grows, companies are looking for faster – and cheaper – ways to make it",https://www.theguardian.com/books/2025/jul/03/audiobook-voice-actors-ai-robot-narrators,2025-07-02T15:00:05Z,The Guardian,https://i.guim.co.uk/img/media/f799afa46795d9abd38afd0e4b95b1601301f79a/0_0_2500_2000/master/2500.jpg?width=1200&height=630&quality=85&auto=format&fit=crop&overlay-align=bottom%2Cleft&overlay-width=100p&overlay-base64=L2ltZy9zdGF0aWMvb3ZlcmxheXMvdGctZGVmYXVsdC5wbmc&enable=upscale&s=8f5742c0da017db734c34f8604a459a5
Crunchyroll's lazy AI subtitles have anime fans furious,"Necronomico and the Cosmic Horror Show, one of Crunchyroll's new series, shows proof a translator used ChatGPT to write the subtitles.",https://www.engadget.com/entertainment/streaming/crunchyrolls-lazy-ai-subtitles-have-anime-fans-furious-145621722.html,2025-07-02T14:56:21Z,Engadget,https://s.yimg.com/ny/api/res/1.2/PNOOi9eo4EgfEEmb7BAvbA--/YXBwaWQ9aGlnaGxhbmRlcjt3PTEyMDA7aD02NzU-/https://s.yimg.com/os/creatr-uploaded-images/2025-07/e8fe3b90-5749-11f0-aa8a-b3f6b9450452
"2 Canadian AI Stocks That Could Turn $5,000 Into $50,000","The future of AI stocks is here right now. So, let's look at some top ways to invest.",https://www.fool.ca/2025/07/02/2-canadian-ai-stocks-that-could-turn-5000-into-50000/,2025-07-02T13:30:00Z,The Motley Fool Canada,https://www.fool.ca/wp-content/uploads/2024/04/GettyImages-1461323126-1200x675.jpg
"The 2030s Will See Fortune 500 Dying Like Never Before, Warns Vinod Khosla","Venture capitalist Vinod Khosla has said artificial intelligence will be able to perform 80% of the most economically valuable jobs within the next five years, sparking unprecedented transformation in industries and society.",https://analyticsindiamag.com/ai-news-updates/the-2030s-will-see-fortune-500-dying-like-never-before-warns-vinod-khosla/,2025-07-02T06:33:53Z,Analytics India Magazine,https://analyticsindiamag.com/wp-content/uploads/2024/04/Khosla.jpg
