title,description,url,publishedAt,source,image
"Top 10 Startup and Tech Funding News - June 5, 2025","It’s Thursday, June 5, 2025, and we’re back with your daily tech funding roundup, tracking where capital is flowing and which startups are laying the groundwork for what comes next. Today’s lineup spans defense tech, brain-computer interfaces, social commerce, AI workflow tools, insurtech, biotech, and beyond. From Anduril’s $2.5 billion raise to expand autonomous defense",https://techstartups.com/2025/06/05/top-10-startup-and-tech-funding-news-june-5-2025/,2025-06-05T22:48:02Z,TechStartups.com,https://techstartups.com/wp-content/uploads/2025/06/Signify-Bio.jpg
Seven nuclear stocks worth considering,Industry outlook brightening on demand for clean energy to help power AI and European pivot away from Russian gas,https://www.theglobeandmail.com/investing/investment-ideas/number-cruncher/article-nuclear-stocks-cruncher-meta-constellation-ai/,2025-06-05T22:00:01Z,The Globe and Mail,https://www.theglobeandmail.com/resizer/v2/HS6LZR56NNA3FH46OARZX2Z3CY.jpg?auth=13088cc084fa42765fa4d18879f1fdb98e0bc6567d3b8b07ae537f647b13bbee&width=1200&height=800&quality=80&smart=true
Timbaland Pisses People Off By Announcing His First AI Artist,"Humans will be involved in making the music, but the humans of the internet still hate what he's doing",https://kotaku.com/timbaland-ai-music-tata-stage-zero-suno-1851783772,2025-06-05T21:35:00Z,Kotaku,"https://i.kinja-img.com/image/upload/c_fill,h_675,pg_1,q_80,w_1200/ba6912ac8c0aa78b19cd93499581a97c.webp"
"The more features Samsung Health gets, the more I dread the inevitable AI subscription","Samsung keeps warning that your free access to Galaxy AI ends this year. When it does, your Galaxy Watch experience will change.",https://www.androidcentral.com/wearables/samsung-galaxy-watch/i-think-samsung-health-likely-to-get-ai-subscription-soon,2025-06-05T21:22:07Z,Android Central,https://cdn.mos.cms.futurecdn.net/72fkSZJh2z7HYmD29AMNtX.jpg
"Alberta grid operator’s power cap could thwart province’s AI data-centre ambitions, critics say",Decision to limit energy allotted to new projects comes as province sees surge in demand from developers,https://www.theglobeandmail.com/business/article-alberta-grid-operators-power-cap-could-thwart-provinces-ai-data-centre/,2025-06-05T20:17:22Z,The Globe and Mail,https://www.theglobeandmail.com/resizer/v2/76VXYX5BLNAEZG6T7XMLJZQGWU.JPG?auth=9bf62566893288cf867f706652467939cf4235318957e81e85937a3d33924e4e&width=1200&height=800&quality=80&smart=true
Nvidia finds a sneaky way to keep selling GPUs to China - here’s why it could change everything,"Cheaper, weaker GPUs might be China’s golden ticket to massive AI infrastructure growth",https://www.techradar.com/pro/nvidia-will-sell-a-special-version-of-its-most-powerful-gpu-to-china-to-skirt-around-us-export-restrictions-but-that-wont-be-enough,2025-06-05T18:34:00Z,TechRadar,https://cdn.mos.cms.futurecdn.net/XToqRG8cEwRKTJqdLsMbfm.jpg
Using Swarm Learning approach to aid doctors in treating stroke patients,Researchers at DZNE and the Department of Vascular Neurology at the University Hospital Bonn (UKB) aim to develop a computer model based on artificial intelligence (AI) to aid doctors in treating stroke patients.,https://www.news-medical.net/news/20250605/Using-Swarm-Learning-approach-to-aid-doctors-in-treating-stroke-patients.aspx,2025-06-05T14:46:00Z,News-Medical.net,https://www.news-medical.net/image-handler/picture/2014/7/Stroke-620x480.jpg
VerSe Innovation Denies Allegations of Fake Biz Deals with Builder.ai,"London-based artificial intelligence startup Builder.ai, which is currently facing multiple allegations and is staring at bankruptcy, allegedly “faked business deals with Indian social media startup VerSe Innovation to falsely inflate its sales,” according to a Bloomberg report.",https://analyticsindiamag.com/ai-startups/verse-innovation-denies-allegations-of-fake-biz-deals-with-builder-ai/,2025-06-05T10:33:24Z,Analytics India Magazine,https://analyticsindiamag.com/wp-content/uploads/2024/09/Most-Coding-Bootcamps-in-India-are-Scams.jpg
New dual-AI strategy targets generative cheating in university assessments,"Assessments that rely on general prompts or outdated content are especially easy targets for generative AI models trained on large public datasets. By contrast, tasks that require recent events, access to exclusive resources, or draw on personal experiences are harder for AI to fake convincingly.",https://www.devdiscourse.com/article/technology/3446446-new-dual-ai-strategy-targets-generative-cheating-in-university-assessments,2025-06-05T13:11:42Z,Devdiscourse,https://www.devdiscourse.com/remote.axd?https://devdiscourse.blob.core.windows.net/devnews/04_06_2025_12_04_27_0093335.png?width=920&format=jpeg
Will AI Replace Coders? Sundar Pichai Has a Refreshingly Honest Take,Pichai addresses AI job fears,https://in.mashable.com/tech/95259/will-ai-replace-coders-sundar-pichai-has-a-refreshingly-honest-take,2025-06-06T05:39:34Z,Mashable India,https://sm.mashable.com/mashable_in/seo/default/z3wq-2025-06-06t105642256_zcrn.jpg
Broadcom beats on earnings and revenue,Broadcom’s artificial intelligence business is at the center of the company’s recent boom.,https://www.cnbc.com/2025/06/05/broadcom-avgo-earnings-report-q2-2025.html,2025-06-05T20:31:09Z,CNBC,https://image.cnbcfm.com/api/v1/image/108075459-1734045037227-gettyimages-2189656779-075a6757_wegh5q6p.jpeg?v=1749153852&w=1920&h=1080
How to use Gemini on Android,Get Google’s AI Gemini working on your Android phone,https://www.techradar.com/phones/android/how-to-use-gemini-on-android,2025-06-06T11:29:00Z,TechRadar,https://cdn.mos.cms.futurecdn.net/UDM5yV9jxpQaY89V4iV5qP.jpg
"Alphabet CEO Sundar Pichai says AI won't lead to job cuts, will be ""an accelerator""","Alphabet won't be cutting jobs due to AI, CEO says",https://www.techradar.com/pro/alphabet-ceo-sundar-pichai-says-ai-wont-lead-to-job-cuts-will-be-an-accelerator,2025-06-06T10:26:00Z,TechRadar,https://cdn.mos.cms.futurecdn.net/LG5Fvt4MQXc6k4opUSkymj.jpg
"Letters to the editor, June 6: ‘I guarantee Mark Carney will not achieve everything, but he may succeed in some of his agenda. Thus Canada would progress’",In today’s letters to the editor: Mark Carney; immigration; international students; AI; Amazon reviews; Canadian Tire and Hudson’s Bay,https://www.theglobeandmail.com/opinion/letters/article-i-guarantee-mark-carney-will-not-achieve-everything/,2025-06-06T08:00:00Z,The Globe and Mail,https://www.theglobeandmail.com/resizer/v2/6DEHROCH2BAR5O4W33YPO26M54.JPG?auth=4def3914a586d8451c553dee5a155bca3684ab6b50fadf9b9974ea7da1ef97f7&width=1200&height=800&quality=80&smart=true
Google's 'Search Live' test in AI Mode kicks off for enrolled mobile users,Users with an Android or iOS phone might want to keep a lookout.,https://www.androidcentral.com/apps-software/ai/google-ai-mode-search-live-test-android-ios-underway,2025-06-06T17:44:59Z,Android Central,https://cdn.mos.cms.futurecdn.net/qp6AKXeh96jvyE7u9MfiyE.png
New Chinese mini PC from Lenovo combines 16-core Ryzen AI chip with 128GB RAM and workstation-level GPU for serious AI workloads,"The LCFC AI mini PC is powerful, but with a price to match",https://www.techradar.com/pro/lenovo-quietly-launched-a-pc-based-on-amds-fastest-ai-cpu-but-i-dont-think-it-will-go-on-sale-outside-china-yet,2025-06-06T17:33:00Z,TechRadar,https://cdn.mos.cms.futurecdn.net/MtdoLV2p8mK6dmjE2CZk3V.jpg
Gemini app rolling out 'scheduled actions' to AI Pro and AI Ultra,"Following the 2.5 Pro model update yesterday, Google is introducing “scheduled actions” to the Gemini app...",https://9to5google.com/2025/06/06/gemini-app-scheduled-actions/,2025-06-06T17:14:27Z,9to5Google,https://i0.wp.com/9to5google.com/wp-content/uploads/sites/4/2025/05/Gemini-Typing-A-Prompt.jpg?resize=1200%2C628&quality=82&strip=all&ssl=1
"Sam Altman says AI chats should be as private as ‘talking to a lawyer or a doctor’, but OpenAI could soon be forced to keep your ChatGPT conversations forever",Should AI chats always be privileged?,https://www.techradar.com/computing/artificial-intelligence/sam-altman-says-ai-chats-should-be-as-private-as-talking-to-a-lawyer-or-a-doctor-but-openai-could-soon-be-forced-to-keep-your-chatgpt-conversations-forever,2025-06-06T16:50:31Z,TechRadar,https://cdn.mos.cms.futurecdn.net/sp5sXZYvZg86uX7YyzWzX8.jpg
Who wrote the Bible? AI tries to give us an answer,"A new AI study shows technology that can be used to determine whether ancient writings, like the Bible, had one or multiple writers.",https://bgr.com/tech/who-wrote-the-bible-ai-tries-to-give-us-an-answer/,2025-06-06T16:23:00Z,BGR,https://bgr.com/wp-content/uploads/2025/06/ai-study-bible-1.jpg?quality=82&strip=all
"Lately: Trump and Musk’s bromance fallout, professors embracing AI and turning off GPS","Plus, the Switch 2 is finally out",https://www.theglobeandmail.com/business/article-lately-trump-and-musks-bromance-fallout-professors-embracing-ai-and/,2025-06-06T14:09:39Z,The Globe and Mail,https://www.theglobeandmail.com/resizer/v2/H3O7UZ3SQFHQNA7RWCNLLMBNG4.JPG?auth=3ef75c9fd3f90f0420681063728dd8513631096072bd8823e846499adfc1ab34&width=1200&height=800&quality=80&smart=true
Intel Arc GPU driver update fixes audio bugs on the MSI Claw,"The latest Intel Arc GPU driver, version 32.0.101.6877, fixes ""audio glitches"" on compatible Core Ultra Series 2 gaming handhelds like the MSI Claw 8 AI+.",https://www.windowscentral.com/gaming/pc-gaming/intel-arc-graphics-driver-june-2025-audio,2025-06-06T13:54:57Z,Windows Central,https://cdn.mos.cms.futurecdn.net/swHtmitNBVsDCikXW8L86H.jpg
Combination of facial thermal imaging and AI shows promise in detecting coronary artery disease,"A combination of facial thermal imaging and artificial intelligence (AI) can accurately predict the presence of coronary artery disease, finds research published in the open access journal BMJ Health & Care Informatics.",https://www.news-medical.net/news/20250606/Combination-of-facial-thermal-imaging-and-AI-shows-promise-in-detecting-coronary-artery-disease.aspx,2025-06-06T13:22:00Z,News-Medical.net,https://www.news-medical.net/image-handler/picture/2014/7/Coronary_Artery_Disease-620x480.jpg
"Claude 4 Review: Good, Bad, or Waste of Time?",Check out this review if you want to quickly find out if the updated Claude 4 AI model is what you're looking for.,https://www.androidheadlines.com/2025/06/claude-4-review-good-bad-or-waste-of-time.html,2025-06-06T21:52:54Z,Android Headlines,https://www.androidheadlines.com/wp-content/uploads/2025/05/Claude-4-Opus-Sonnet-AI-logo-featured-scaled.webp
"AI 'hallucinates' constantly, but there's a solution",Neurosymbolic AI combines the learning of LLMs with teaching the machine formal rules that should make them more reliable and energy efficient.,https://www.livescience.com/technology/artificial-intelligence/ai-hallucinates-constantly-but-theres-a-solution,2025-06-06T21:00:00Z,Livescience.com,https://cdn.mos.cms.futurecdn.net/JGm5RAEJypJyLQYyBcYUPN.jpg
"Meta may have stolen my dead wife's books, but her printed words help my son and me endure","Late Gemma Carey's writings misused in AI training, sparking grief and tech concerns in Australia as husband Ben O'Mara speaks out.",https://www.canberratimes.com.au/story/8985936/ben-omara-how-i-cope-after-meta-stole-my-dead-wife-gemma-careys-books/,2025-06-06T19:30:00Z,The Canberra Times,https://www.canberratimes.com.au/images/transform/v1/crop/frm/rJkJNFPcdBkDQKqtkgHSjA/486a2eb2-5ca6-4ee1-86c7-08e893538e72.jpg/r0_135_4745_2626_w1200_h630_fmax.jpg
"AI analysis suggests Dead Sea Scrolls are older than scientists thought, but not all experts are convinced","An AI analysis of the Dead Sea Scrolls, which include texts from the Hebrew Bible, could mean they were composed earlier than experts thought.",https://www.livescience.com/archaeology/ai-analysis-suggests-dead-sea-scrolls-are-older-than-scientists-thought-but-not-all-experts-are-convinced,2025-06-06T19:08:06Z,Livescience.com,https://cdn.mos.cms.futurecdn.net/hKYi2NVms4W6sEqcGyG3k4.jpg
Google Gemini Just Leveled Up with Powerful Scheduled Actions,"Google is rolling out ""Scheduled Actions"" as a new, powerful feature for its AI-powered Gemini assistant. More details here.",https://www.androidheadlines.com/2025/06/google-gemini-new-scheduled-actions.html,2025-06-06T18:54:50Z,Android Headlines,https://www.androidheadlines.com/wp-content/uploads/2024/02/Google-Gemini-App-AH-2-jpg.webp
Samsung's Perplexity AI Deal: Is Google Playing 4D Chess?,Samsung and Perplexity's potential AI deal for the Galaxy S26 series could actually be a positive move for Google in its current situation.,https://www.androidheadlines.com/2025/06/samsungs-perplexity-ai-deal-is-google-playing-4d-chess.html,2025-06-06T22:07:56Z,Android Headlines,https://www.androidheadlines.com/wp-content/uploads/2025/06/Samsung-Perplexity-AI-deal-google-4d-chess-behind-featured.jpg
The chatbot will see you now,"The AI assistant isn’t your doctor, but it can make you a smarter patient",https://www.livemint.com/opinion/online-views/ai-health-advice-chatgpt-medical-tips-gemini-health-chatbot-grok-doc-review-ai-consultation-chatbot-health-assistant-11749041118623.html,2025-06-06T18:30:00Z,Livemint,https://www.livemint.com/lm-img/img/2025/06/05/1600x900/chatbot_1749120071533_1749120071739.png
"Letters to the editor, June 7: ‘The AI revolution needs thoughtful regulation’",In today’s letters to the editor: Afghan refugees; AI; tax reform; the French embassy in Baghdad; sperm donors; roaming free; go to church?,https://www.theglobeandmail.com/opinion/letters/article-the-ai-revolution-needs-thoughtful-regulation/,2025-06-07T08:00:00Z,The Globe and Mail,https://www.theglobeandmail.com/resizer/v2/UMACEI7CRVHTPLHT76LPXVGK6M.JPG?auth=452969c2f9b81f36f630a3865a5e3fbe9de07ea03ac9a39677cc1f3e6962e6f0&width=1200&height=800&quality=80&smart=true
How Stripe Used AI to Boost Fraud Detection from ‘59-97% Overnight’,Stripe’s use of AI to boost fraud detection and increase security measures is a crucial case study on how AI can be used in payment processing.,https://analyticsindiamag.com/global-tech/how-stripe-used-ai-to-boost-fraud-detection-from-59-97-overnight/,2025-06-07T05:13:55Z,Analytics India Magazine,https://analyticsindiamag.com/wp-content/uploads/2025/06/Screenshot-2025-06-06-at-4.43.16 PM.png
GOP Changes Provision on AI Regulation by States,Senate Republicans have made changes to their party's sweeping tax bill in hopes of preserving a new policy that would prevent states from regulating artificial intelligence...,https://www.newser.com/story/369872/gop-tweaks-contentious-provision-on-ai-regulation.html,2025-06-07T03:30:00Z,Newser,https://img1-azrcdn.newser.com/image/1614958-12-20250606175647.jpeg
This Morning star Alison Hammond calls out 'AI stories' as she makes big denial,The presenter shared a video copying Meghan Markle's pregnancy dance,https://www.manchestereveningnews.co.uk/news/tv/morning-star-alison-hammond-calls-31810673,2025-06-07T17:44:30Z,Manchester Evening News,https://i2-prod.manchestereveningnews.co.uk/article31586568.ece/ALTERNATES/s1200/1_This-Mornings-Alison-Hammond-sprints-off-set-to-be-with-son-as-shes-replaced-by-Trinny-Woodall.jpg
A ban on state AI laws could smash Big Tech’s legal guardrails,"The Senate is pushing ahead with language in its budget bill that could restrict states from regulating AI for a decade, and opponents warn it could hamper other consumer protections.",https://www.theverge.com/politics/681727/ro-khanna-ai-state-law-moratorium-reconciliation,2025-06-07T14:00:00Z,The Verge,https://platform.theverge.com/wp-content/uploads/sites/2/chorus/uploads/chorus_asset/file/25544255/2162439650.jpg?quality=90&strip=all&crop=0%2C10.746068936881%2C100%2C78.507862126237&w=1200
"NVIDIA Next Place of Business After Middle East Is The EU; CEO Jensen Huang Set To Announce Germany's Biggest ""AI Factory"" Next Week","NVIDIA CEO's next trip is likely to be to the EU, where he is set to visit Germany first to announce a large-scale AI project.",https://wccftech.com/nvidia-next-place-of-business-after-middle-east-is-the-eu/,2025-06-07T12:28:22Z,Wccftech,https://cdn.wccftech.com/wp-content/uploads/2025/05/We-already-know-when-Nvidia-CEO-Jensen-Huang-will-deliver-his-keynote-at-Computex-this-year.jpg
I recommend the Pixel 9 to most people looking to upgrade - especially while it's $250 off,"While the Pro model gets all the attention, Google's Pixel 9 is impressive on its own, boasting a sleek design, gorgeous camera, and robust AI features.",https://www.zdnet.com/article/i-recommend-the-pixel-9-to-most-people-looking-to-upgrade-especially-while-its-250-off/,2025-06-07T09:00:00Z,ZDNet,https://www.zdnet.com/a/img/resize/4f1fcea82ea06b08be5f88222d97115d399ffec3/2024/08/21/bb192b00-d031-45e8-b9bf-8b54026682aa/google-pixel-9-zdnet-7.jpg?auto=webp&fit=crop&height=675&width=1200
"'Technology Must Complement, Not Replace, Human Mind In Judicial Decision-Making': CJI Gavai","The CJI said that complex legal issues often require an understanding of human context, societal implications, and ethical dilemmas that AI, in its current form, cannot fully grasp",https://www.news18.com/india/technology-must-complement-not-replace-human-mind-in-judicial-decision-making-cji-gavai-9374168.html,2025-06-08T00:30:36Z,News18,https://images.news18.com/ibnlive/uploads/2025/05/CJI-BR-Gavai-PTI-2025-05-c143ca1361153c1251e535efd0bab3cf.jpg
Agent-based computing is outgrowing the web as we know it,"AI agents are moving from passive assistants to active participants. Today, we ask them to do. Tomorrow, we’ll authorize them to act.",https://venturebeat.com/ai/agent-based-computing-is-outgrowing-the-web-as-we-know-it/,2025-06-07T22:15:00Z,VentureBeat,https://venturebeat.com/wp-content/uploads/2025/06/upscalemedia-transformed.webp?w=1024?w=1200&strip=all
UK ministers delay AI regulation amid plans for more ‘comprehensive’ bill,Law expected to include safety and copyright issues but delay likely to raise concerns about ongoing lack of regulation,https://www.theguardian.com/technology/2025/jun/07/uk-ministers-delay-ai-regulation-amid-plans-for-more-comprehensive-bill,2025-06-07T18:00:12Z,The Guardian,https://i.guim.co.uk/img/media/04aac95472b6e1126dd76c2f3bb09d8e462a02aa/745_431_5051_4041/master/5051.jpg?width=1200&height=630&quality=85&auto=format&fit=crop&overlay-align=bottom%2Cleft&overlay-width=100p&overlay-base64=L2ltZy9zdGF0aWMvb3ZlcmxheXMvdGctZGVmYXVsdC5wbmc&enable=upscale&s=cd5d08dc1bcb72d0684ecbed83aff9e6
How Docusign is modernizing the age-old business contract,The digital agreement company implemented artificial intelligence agents this year.,https://www.livemint.com/companies/how-docusign-is-modernizing-the-age-old-business-contract-11749308973553.html,2025-06-07T18:30:00Z,Livemint,https://www.livemint.com/lm-img/img/2025/06/07/1600x900/im-41677055_1749308977534_1749308999060.jpg
Experts offer advice to new college grads on entering the workforce in the age of AI,We asked three experts what fresh college graduates can do to prepare as artificial intelligence changes how Americans work. Here's what they said.,https://www.cbsnews.com/news/ai-jobs-chatgpt-college-graduate-work/,2025-06-06T20:42:22Z,CBS News,https://assets3.cbsnewsstatic.com/hub/i/r/2025/06/06/8fb7c37c-9263-46e9-bedf-e454a40ab8f3/thumbnail/1200x630/a26ac6e9b074dfbd5a82ffc0030aa2a6/gettyimages-2186780970.jpg?v=8e774d26301ae5e7a27489083c0cf8b6
Deepfakes of the pope are racking up millions of views on Youtube and Tiktok,Leo XIV has said he wants to stand up to the challenge posed by AI.,https://www.thejournal.ie/pope-leo-xiv-stands-up-to-artificial-intelligence-challenges-6725213-Jun2025/,2025-06-08T06:30:46Z,TheJournal.ie,https://img2.thejournal.ie/article/6725213/river/?height=400&version=6725492
Reformed Leaving Cert would allow too many opportunities to cheat using AI,"Every step is already susceptible to AI intervention, from brainstorming ideas to generating a structure for each section, to writing the entire piece",https://www.irishtimes.com/opinion/2025/06/08/breda-obrien-reformed-leaving-cert-will-allow-too-many-opportunities-to-cheat-using-ai/,2025-06-08T06:11:00Z,The Irish Times,https://www.irishtimes.com/resizer/v2/FAUJBYAVVZDDFL5GCD3Y5D6B2A.JPG?smart=true&auth=a491dcc50a87e26c1dd327752f8ddc79eb0bf79ed4f357a120b0ed31c73103c5&width=1200&height=630
"Canada’s record trade deficit, BoC’s rate pause and Trump doubles steel and aluminium tariffs: Business and investing stories for the week of June 8","Plus, is AI dulling critical-thinking skills?",https://www.theglobeandmail.com/business/article-trade-deficit-bank-of-canada-trump-tariffs-june-8/,2025-06-08T13:00:00Z,The Globe and Mail,https://www.theglobeandmail.com/resizer/v2/BTPCZM36UZGCJP2KXLEPM4RH3U.JPG?auth=6f5cdb9fa908cd13ae9b214acfa0cc4f1d8ef8a47909ab06b4e49bbbcc46f922&width=1200&height=800&quality=80&smart=true
"Search Live rolls out to some iOS, Android users who get to tell their phones exactly what they need","Soon, iOS and Android users will be able to converse with AI Mode's ""Search Live"" feature.",https://www.phonearena.com/news/search-live-coming-soon-bringing-chatty-search-to-ios-android_id171108,2025-06-08T03:28:40Z,PhoneArena,https://m-cdn.phonearena.com/images/article/171108-wide-two_1200/Search-Live-rolls-out-to-some-iOS-Android-users-who-get-to-tell-their-phones-exactly-what-they-need.jpg
AI transforms sightseeing for visually impaired users,"The VIPTour AI system empowers visually impaired individuals to explore unfamiliar environments, enhancing emotional engagement and cognitive mapping accuracy.",https://www.news-medical.net/news/20250608/AI-transforms-sightseeing-for-visually-impaired-users.aspx,2025-06-09T00:05:00Z,News-Medical.net,https://www.news-medical.net/images/news/ImageForNews_811643_17491980957283726.jpg
Best-selling Ray-Ban Meta glasses are 20 per cent off in rare deal,"Snap photos, stream music and chat with AI through your sunnies.",https://7news.com.au/best-picks/best-selling-ray-ban-meta-glasses-are-20-per-cent-off-in-rare-deal-c-18969809,2025-06-08T23:59:55Z,7NEWS.com.au,https://images.7news.com.au/publication/C-18969809/7c5018ae5cecd038f68f36f380822b4dad124eaf-16x9-x0y0w1280h720.jpg?imwidth=1200
Young people and AI,We are now arguably going through another “industrial revolution” of sorts.,https://www.irishtimes.com/opinion/letters/2025/06/08/young-people-and-ai/,2025-06-08T23:06:00Z,The Irish Times,https://www.irishtimes.com/resizer/v2/6GVJTWXOI5FYPOLOK3JLHZZVVU.jpg?smart=true&auth=2781af11b396c223ac2b1f05df19ecc2dafc39caa2ffa2f14069f0e5a11189ee&width=1200&height=630
"At WWDC 25, Apple should make amends with developers after AI shortfalls and lawsuits",Apple has an opportunity to deliver a WWDC that would encourage developers to invest more of their time in the ecosystem.,https://techcrunch.com/2025/06/08/at-wwdc-25-apple-should-make-amends-with-developers-after-ai-shortfalls-and-lawsuits/,2025-06-08T14:00:00Z,TechCrunch,https://techcrunch.com/wp-content/uploads/2025/06/Apple-WWDC25-event-branding_big.jpg.large_.jpg?w=980
"Apple heads into annual showcase reeling from AI missteps, tech upheaval and Trump's trade war","CUP (AP) — After stumbling out of the starting gate in Big Tech's pivotal race to capitalize on artificial intelligence, Apple will try to regain its footing Monday at its",https://www.thestar.com/news/world/united-states/apple-heads-into-annual-showcase-reeling-from-ai-missteps-tech-upheaval-and-trumps-trade-war/article_237033c6-a266-5bbd-9fba-dae7cecbbff3.html,2025-06-09T04:02:42Z,Toronto Star,https://bloximages.chicago2.vip.townnews.com/thestar.com/content/tncms/assets/v3/editorial/2/ae/2aef10a3-4fd9-53f8-96be-b11e2b8bd622/68465d730823f.image.jpg?crop=1620%2C851%2C0%2C114&resize=1200%2C630&order=crop%2Cresize
"Apple WWDC 2025 Starts Today: Live Event Timings, Where To Watch And More",WWDC 2025 keynote is just a few hours from now when Tim Cook and his team will talk about the new iOS 26 update and AI features.,https://www.news18.com/tech/apple-wwdc-2025-starts-today-live-event-timings-where-to-watch-and-more-9374829.html,2025-06-09T02:00:07Z,News18,https://images.news18.com/ibnlive/uploads/2025/03/Apple-WWDC-2025-dates-iOS-19-and-more-expected-2025-03-548513beb1ebd477a74861dd707ea086-16x9.jpg
"Meta in talks over Scale AI stake that could top $10B, Bloomberg reports","Meta Platforms is in talks to make an investment that could exceed $10 billion in artificial intelligence startup Scale AI, Bloomberg News reported on Sunday.",https://nypost.com/2025/06/08/business/meta-in-talks-over-scale-ai-stake-that-could-top-10b-bloomberg-reports/,2025-06-08T19:26:46Z,New York Post,https://nypost.com/wp-content/uploads/sites/2/2025/06/meta-scale-comp-106105826_63c4d7.jpg?quality=75&strip=all&w=1024
We're offloading mental tasks to AI. It could be making us stupid,Whether we lose some of the skills artificial intelligence performs for us largely depends on how we use this tech,https://www.salon.com/2025/06/08/were-offloading-mental-tasks-to-ai-it-could-be-making-us-stupid/,2025-06-08T17:00:06Z,Salon,https://mediaproxy.salon.com/width/1200/https://media2.salon.com/2025/06/ai_tech_brain_gettyimages-2051248634.jpg
Multimodal AI technology boosts early detection of skin conditions,Detection of melanoma and a range of other skin diseases will be faster and more accurate with a new artificial intelligence (AI) powered tool that analyses multiple imaging types simultaneously.,https://www.news-medical.net/news/20250609/Multimodal-AI-technology-boosts-early-detection-of-skin-conditions.aspx,2025-06-09T11:51:00Z,News-Medical.net,https://www.news-medical.net/image-handler/picture/2014/7/Skin_Cancer-620x480.jpg
