title,description,url,publishedAt,source,image
"""New Era In Publishing"": Melania Trump Uses AI To Narrate Her Memoir In Her Own Voice","US First Lady Melania Trump has announced the release of an audiobook version of her memoir 'Melania', narrated entirely by artificial intelligence in her own voice.",https://www.ndtv.com/world-news/new-era-in-publishing-melania-trump-uses-ai-to-narrate-her-memoir-in-her-own-voice-8484720,2025-05-23T01:18:33Z,NDTV News,"https://c.ndtvimg.com/2020-10/0pmaa8mg_melania-trump-afp_625x300_30_October_20.jpg?im=FeatureCrop,algorithm=dnn,width=1200,height=738"
New Google AI generates awe and alarm,"A stunningly lifelike video of a standup comedian delivering a joke, lips synced perfectly to the voice, is just one of several clips going viral after being generated by Google’s latest AI tool.",https://www.cp24.com/news/world/2025/05/22/videos-from-googles-new-ai-video-generator-stir-awe-and-alarm/,2025-05-22T23:02:14Z,CP24 Toronto,https://www.cp24.com/resizer/v2/KPZNBKTC6NBM5GBEZQEBM6TUOA.jpg?smart=true&auth=a6dfe4e7ed72f2c3a5969d96229faa38552fcf8880d7e15fcdf6bfaa865d2db3&width=1200&height=630
Tech CEOs are using AI to replace themselves,CEOs from Klarna and Zoom had AI avatars deliver part of their earnings reports this week.,https://www.theverge.com/news/673194/tech-ceos-zoom-klarna-replace-earnings,2025-05-22T22:33:38Z,The Verge,https://platform.theverge.com/wp-content/uploads/sites/2/2025/05/videoframe_10281.png?quality=90&strip=all&crop=0%2C3.4613147178592%2C100%2C93.077370564282&w=1200
Anthropic's new Claude 4 models promise the biggest AI brains ever,Smart enough to beat Pokémon,https://www.techradar.com/computing/artificial-intelligence/anthropics-new-claude-4-models-promise-the-biggest-ai-brains-ever,2025-05-22T21:00:00Z,TechRadar,https://cdn.mos.cms.futurecdn.net/k647kgjGjTiap2PoA7ZcC9.png
How a scientist who studies ‘super agers’ exercises for a longer life,"Eric Topol’s book talks about a future when advanced drugs, biochemistry and AI should allow us to slow how fast we age. Meanwhile, he has some tips.",https://www.afr.com/life-and-luxury/health-and-wellness/how-a-scientist-who-studies-super-agers-exercises-for-a-longer-life-20250522-p5m1fg,2025-05-22T20:46:36Z,The Australian Financial Review,https://static.ffx.io/images/$zoom_0.1765%2C$multiply_4%2C$ratio_1.777778%2C$width_1059%2C$x_0%2C$y_43/t_crop_custom/c_scale%2Cw_800%2Cq_88%2Cf_jpg/t_afr_no_label_no_age_social_wm/9eeaa66df99407a76c2be4fdf3412da1af92acce
What in the world are Jony Ive and Sam Altman building?,"Google and Open AI have hinted at where they think AI hardware will go — and so far, it looks like Jony Ive and Sam Altman aren’t betting on glasses.",https://www.theverge.com/column/672505/jony-ive-sam-altman-smart-glasses-ai-hardware-wearables-gadgets,2025-05-22T20:02:58Z,The Verge,https://platform.theverge.com/wp-content/uploads/sites/2/2025/05/257770_Altman_Ive_CVirginia.jpg?quality=90&strip=all&crop=0%2C10.732984293194%2C100%2C78.534031413613&w=1200
"Don’t count AI-generated content as CanCon, CRTC hears","OTTAWA — The CRTC should not classify material generated by artificial intelligence as Canadian content, unions representing actors and writers told the regulator Thursday.",https://www.guelphtoday.com/national-news/dont-count-ai-generated-content-as-cancon-crtc-hears-10697025,2025-05-22T20:00:51Z,GuelphToday,https://www.vmcdn.ca/f/files/shared/feeds/cp/2025/05/37cc5db1af083250b145c9f8b7c0c6cf641d7b9160a8cddabe12b51292b1924b.jpg;w=1200;h=800;mode=crop
AI could account for nearly half of data centre power usage ‘by end of year’,Artificial intelligence systems forecast to require almost as much energy by end of decade as Japan uses today,https://www.theguardian.com/environment/2025/may/22/ai-data-centre-power-consumption,2025-05-22T15:07:15Z,The Guardian,https://i.guim.co.uk/img/media/cd78fc0685ca2ad26598574ab3c7ea866929c81c/231_0_2917_2335/master/2917.jpg?width=1200&height=630&quality=85&auto=format&fit=crop&overlay-align=bottom%2Cleft&overlay-width=100p&overlay-base64=L2ltZy9zdGF0aWMvb3ZlcmxheXMvdGctZGVmYXVsdC5wbmc&enable=upscale&s=c59b1e17c60b26140119bceb3f441fdb
Machine learning key to early detection of acute malnutrition in Sub-Saharan Africa,"Among the diverse indicators tested, previous malnutrition outcomes ranked highest in predictive power, followed by sub-county identifiers and satellite-based GPP data. Interestingly, models trained solely on GPP data still outperformed the statistical baseline, demonstrating the power of remotely sensed agricultural indicators in capturing early signals of food insecurity and health risk.",https://www.devdiscourse.com/article/health/3418602-machine-learning-key-to-early-detection-of-acute-malnutrition-in-sub-saharan-africa,2025-05-21T13:05:26Z,Devdiscourse,https://www.devdiscourse.com/remote.axd?https://devdiscourse.blob.core.windows.net/devnews/20_05_2025_12_14_15_6804238.png?width=920&format=jpeg
"Days after Ola Krutrim employee found dead in Bengaluru, social media post hints at ‘work pressure’","Nikhil Somwanshi, a 25-year-old machine learning engineer at Ola Krutrim, was found dead on May 8. He allegedly died by suicide.",https://indianexpress.com/article/cities/bangalore/ola-krutrim-employee-dead-bengaluru-work-pressure-10016946/,2025-05-20T09:18:18Z,The Indian Express,https://images.indianexpress.com/2025/05/may-11-65.jpg
Your Voice Could Hide The Tell-Tale Signs of Parkinson's Disease,"In a continued effort to catch neurodegenerative diseases early, researchers directed machine learning models to see if they could 'hear' Parkinson's disease in patients' voices.",https://www.sciencealert.com/your-voice-could-hide-the-tell-tale-signs-of-parkinsons-disease,2025-05-20T02:55:15Z,ScienceAlert,https://www.sciencealert.com/images/2025/05/older_women_talking_header.jpg
"IIT-Madras, Emeritus launch certification programme in Applied Artificial Intelligence and Machine Learning","The programme will provide more than 25 tools and libraries, including TensorFlow, Keras, Scikit-Learn and the latest Gen AI models such as Mistral. It will also offer 30+ projects and cases as well as the latest research papers for real-world case studies and in-depth insights.",https://indianexpress.com/article/education/iitm-pravartak-certification-programme-applied-artificial-intelligence-machine-learning-10008349/,2025-05-15T11:10:17Z,The Indian Express,https://images.indianexpress.com/2025/05/IIT-Madras-2.jpg
Why self-driving technology is already outperforming the average driver,Driverless vehicle technology has received a major boost recently owing to advancements in AI and machine learning,https://www.theglobeandmail.com/drive/mobility/article-self-driving-technology-is-already-outperforming-the-average-driver-in/,2025-05-13T09:00:00Z,The Globe and Mail,https://www.theglobeandmail.com/resizer/v2/QFT7BDKP4NBU5CHTTZ632XIXX4.jpg?auth=c2a250c4676b16523069cdcd8f1d7cd0704b1575aed6d84059e99a1509dafb04&width=1200&height=800&quality=80&smart=true
15 Most Popular PPT in Artificial Intelligence Topic on SlideShare in 2025,A list of the most viewed and liked presentations covering various aspects of Artificial Intelligence and machine learning.,https://analyticsindiamag.com/ai-trends/popular-presentations-on-artificial-intelligence-and-machine-learning/,2025-05-13T08:45:31Z,Analytics India Magazine,https://analyticsindiamag.com/wp-content/uploads/2018/01/F1-5-1.jpg
Machine learning model guides smarter gene selection in newborn screening,"More than a decade ago, researchers launched the BabySeq Project, a pilot program to return newborn genomic sequencing results to parents and measure the effects on newborn care.",https://www.news-medical.net/news/20250510/Machine-learning-model-guides-smarter-gene-selection-in-newborn-screening.aspx,2025-05-10T17:41:00Z,News-Medical.net,https://d2jx2rerrg6sh3.cloudfront.net/image-handler/picture/2014/7/DNA_Genetics-620x480.jpg
AI is giving a boost to efforts to monitor health via radar,Today’s radar technology can detect the minute movements when your heart beats or you take a breath. Machine learning turns those signals into vital signs readings.,https://theconversation.com/ai-is-giving-a-boost-to-efforts-to-monitor-health-via-radar-253325,2025-04-29T14:00:00Z,The Conversation UK,https://images.theconversation.com/files/664777/original/file-20250429-56-98p1q6.png?ixlib=rb-4.1.0&rect=0%2C0%2C1918%2C956&q=45&auto=format&w=1356&h=668&fit=crop
AI model predicts future lung cancer risk from a single low-dose chest CT scan,"A deep learning model was able to predict future lung cancer risk from a single low-dose chest CT scan, according to new research published at the ATS 2025 International Conference.",https://www.news-medical.net/news/20250519/AI-model-predicts-future-lung-cancer-risk-from-a-single-low-dose-chest-CT-scan.aspx,2025-05-20T02:28:00Z,News-Medical.net,https://d2jx2rerrg6sh3.cloudfront.net/image-handler/picture/2014/7/174318220-620x480.jpg
How AI can cut costs and boost resilience in microgrids?,"Hybrid AI approaches, combining techniques like deep learning with evolutionary algorithms, can create more robust and adaptable EMS. These systems would dynamically balance trade-offs between energy cost, reliability, and sustainability, providing tailored solutions for diverse microgrid architectures.",https://www.devdiscourse.com/article/technology/3378294-how-ai-can-cut-costs-and-boost-resilience-in-microgrids,2025-05-13T04:01:23Z,Devdiscourse,https://www.devdiscourse.com/remote.axd?https://devdiscourse.blob.core.windows.net/devnews/12_05_2025_13_51_59_7713253.png?width=920&format=jpeg
AI tool uses facial images to predict biological age and cancer survival,"Eyes may be the window to the soul, but a person's biological age could be reflected in their facial characteristics. Investigators from Mass General Brigham developed a deep learning algorithm called FaceAge that uses a photo of a person's face to predict biological age and survival outcomes for patients with cancer.",https://www.news-medical.net/news/20250508/AI-tool-uses-facial-images-to-predict-biological-age-and-cancer-survival.aspx,2025-05-09T02:01:00Z,News-Medical.net,https://d2jx2rerrg6sh3.cloudfront.net/image-handler/picture/2014/7/174318220-620x480.jpg
Cyberpunk 2077 on the Nintendo Switch 2 will offer Nvidia's DLSS tech,CD Projekt Red has confirmed that the Nintendo Switch 2 version of Cyberpunk 2077 will feature Nvidia DLSS (Deep Learning Super Sampling).,https://www.techradar.com/gaming/cyberpunk-2077-on-the-nintendo-switch-2-will-offer-nvidias-dlss-tech,2025-04-22T14:52:47Z,TechRadar,https://cdn.mos.cms.futurecdn.net/XKafT9Btu6ybkUYgSbXqwe.jpg
AI-powered ensemble model sets new benchmark for tea crop health monitoring,"Traditional disease detection methods in agriculture often rely on manual observation by specialists, a process that is labor-intensive, error-prone, and impractical for large-scale farms. The new study tackles this issue by automating disease recognition using advanced deep learning techniques, including transfer learning and ensemble learning.",https://www.devdiscourse.com/article/technology/3351670-ai-powered-ensemble-model-sets-new-benchmark-for-tea-crop-health-monitoring,2025-04-21T03:40:42Z,Devdiscourse,https://www.devdiscourse.com/remote.axd?https://devdiscourse.blob.core.windows.net/devnews/19_04_2025_15_51_12_8466426.png?width=920&format=jpeg
AI boosts liver cancer detection by highlighting doubtful areas,"A new editorial was published in Oncotarget, Volume 16, on April 4, 2025, titled ""Deep learning-based uncertainty quantification for quality assurance in hepatobiliary imaging-based techniques.""",https://www.news-medical.net/news/20250408/AI-boosts-liver-cancer-detection-by-highlighting-doubtful-areas.aspx,2025-04-08T19:41:00Z,News-Medical.net,https://d2jx2rerrg6sh3.cloudfront.net/image-handler/picture/2014/7/174318220-620x480.jpg
Using Deep Learning for Brain Imaging Data Analysis,"The integration of deep learning in neuroimaging enhances diagnostic capabilities, offering new insights into neurological disorders and treatment responses.",https://www.news-medical.net/health/Using-Deep-Learning-for-Brain-Imaging-Data-Analysis.aspx,2025-04-07T13:52:00Z,News-Medical.net,https://d2jx2rerrg6sh3.cloudfront.net/images/Article_Images/ImageForArticle_25980_17440342361114165.jpg
AI model achieves high accuracy in detecting odontogenic sinusitis in dental X-rays,"The Ateneo Laboratory for Intelligent Visual Environments (ALIVE) and international researchers have developed a deep learning model that aims to revolutionize dentistry, with the capability to identify tooth and sinus structures in dental X-rays with an accuracy of 98.2%.",https://www.news-medical.net/news/20250331/AI-model-achieves-high-accuracy-in-detecting-odontogenic-sinusitis-in-dental-X-rays.aspx,2025-03-31T16:46:00Z,News-Medical.net,https://d2jx2rerrg6sh3.cloudfront.net/image-handler/picture/2016/6/Chem_Lab_c618f8c3be2845828afd242b15eaaa94-620x480.jpg
This spacecraft swarm could spot interstellar visitors zipping through our solar system,Hiroyasu Tsukamota has developed a deep-learning-based guidance and control framework called Neural-Rendezvous that could allow spacecraft to safely encounter interstellar objects.,https://www.space.com/space-exploration/tech/this-spacecraft-swarm-could-spot-interstellar-visitors-zipping-through-our-solar-system,2025-03-28T15:00:00Z,Space.com,https://cdn.mos.cms.futurecdn.net/2kbPLhGVRFxv4SEafkhLe4-1200-80.png
AI predicts chronic disease patterns using electronic health records,"AI tools are transforming EHR datasets into actionable clinical insights by identifying disease patterns, predicting comorbidities, and stratifying patient risk. The reviewed studies predominantly used clustering techniques, XGBoost, random forest, and neural networks to uncover multimorbidity networks and forecast disease trajectories.",https://www.devdiscourse.com/article/health/3402999-ai-predicts-chronic-disease-patterns-using-electronic-health-records,2025-05-16T12:47:39Z,Devdiscourse,https://www.devdiscourse.com/remote.axd?https://devdiscourse.blob.core.windows.net/devnews/15_05_2025_18_08_56_3766838.png?width=920&format=jpeg
How does your brain create new memories? Neuroscientists discover ‘rules’ for how neurons encode new information,"As you experience or encounter new things, your brain must encode this information via the right neural networks at the right time.",https://theconversation.com/how-does-your-brain-create-new-memories-neuroscientists-discover-rules-for-how-neurons-encode-new-information-254558,2025-04-16T14:00:00Z,The Conversation UK,https://images.theconversation.com/files/662183/original/file-20250416-56-8q24pf.jpg?ixlib=rb-4.1.0&rect=0%2C92%2C2000%2C1000&q=45&auto=format&w=1356&h=668&fit=crop
New neurons may repair damage from Huntington's disease,New findings show that stimulating natural brain processes may help repair damaged neural networks in Huntington's and other diseases.,https://www.futurity.org/new-neurons-huntingtons-disease-3276372-2/,2025-04-07T18:02:39Z,Futurity: Research News,https://www.futurity.org/wp/wp-content/uploads/2025/04/new-neurons-huntingtons-disease-1600.jpg
What are convolutional neural networks?,CNNs are one of the most important AI technologies you've never heard of,https://www.techradar.com/pro/what-are-convolutional-neural-networks,2025-03-29T10:21:00Z,TechRadar,https://cdn.mos.cms.futurecdn.net/uwQgf5SRKknALE4mwPw9aU-1200-80.jpg
UPSC Essentials | Mains answer practice — GS 3 : Questions on neural networks and technological interventions in empowering women farmers in India (Week 94),Are you preparing for UPSC CSE 2025? Here are questions from GS paper 3 for this week with essential points as the fodder for your answers. Do not miss points to ponder and answer in the comment box below.,https://indianexpress.com/article/upsc-current-affairs/upsc-essentials/upsc-essentials-mains-answer-practice-gs-3-week-94-9892529/,2025-03-18T09:15:12Z,The Indian Express,https://images.indianexpress.com/2025/03/neural-networks.jpg
Redefining human-centered design: AI and EEG for emotion-sensitive architecture,"The AI model employs a hybrid deep learning approach combining convolutional neural networks (CNNs) and long short-term memory (LSTM) architectures. CNNs extract spatial features from EEG data, while LSTMs capture temporal dependencies, enabling precise emotion classification.",https://www.devdiscourse.com/article/business/3286139-redefining-human-centered-design-ai-and-eeg-for-emotion-sensitive-architecture,2025-03-10T05:44:53Z,Devdiscourse,https://www.devdiscourse.com/remote.axd?https://devdiscourse.blob.core.windows.net/devnews/05_03_2025_11_54_32_3528248.webp?width=920&format=jpeg
"Tesla Dojo: Elon Musk's big plan to build an AI supercomputer, explained",Dojo is Tesla’s custom-built supercomputer that’s designed to train its “Full Self-Driving” neural networks.,https://techcrunch.com/2025/02/06/tesla-dojo-elon-musks-big-plan-to-build-an-ai-supercomputer-explained/,2025-02-06T20:09:01Z,TechCrunch,"https://techcrunch.com/wp-content/uploads/2024/08/tesla-dojo.jpg?resize=1200,675"
New LLM optimization technique slashes memory costs up to 75%,Universal Transformer Memory uses neural networks to determine which tokens in the LLM's context window are useful or redundant.,https://venturebeat.com/ai/new-llm-optimization-technique-slashes-memory-costs-up-to-75/,2024-12-13T14:46:56Z,VentureBeat,https://venturebeat.com/wp-content/uploads/2024/12/transformer-memory.jpg?w=1024?w=1200&strip=all
Microsoft Notepad can now write for you using generative AI,Microsoft is rolling out an update to Windows 11 that includes a new AI text generator in Notepad and an object selection tool in Paint.,https://www.theverge.com/news/672984/microsoft-notepad-paint-snipping-tool-generative-ai-windows-insiders,2025-05-22T19:10:35Z,The Verge,"https://platform.theverge.com/wp-content/uploads/sites/2/2025/05/windows_notepad1.jpg?quality=90&strip=all&crop=0,10.732984293194,100,78.534031413613"
Shopify launches generative AI tool that builds complete online stores from keywords,The ‘AI Store Builder’ helps sellers significantly reduce the time and resources required to design their store website,https://www.theglobeandmail.com/business/technology/article-shopify-launches-generative-ai-tool-that-builds-complete-online-stores/,2025-05-21T14:12:10Z,The Globe and Mail,https://www.theglobeandmail.com/resizer/v2/AGNGJB4UIJDM5NBW4CYEOMRV7I.JPG?auth=89c13ffdcd85f97124225ce7f8f7db810d135ca01e59b8d81d41c00ba3a86d20&width=1200&height=800&quality=80&smart=true
Volvo will be the first to install Google’s Gemini in its cars,Volvo said it would be the first automaker to install Google’s Gemini generative AI in its vehicles.,https://www.theverge.com/news/670954/volvo-google-gemini-ai-cars-android-automotive,2025-05-21T07:00:00Z,The Verge,https://platform.theverge.com/wp-content/uploads/sites/2/2025/05/305713_Volvo_EX90.jpg?quality=90&strip=all&crop=0%2C15.098552510009%2C100%2C69.802894979982&w=1200
Google made an AI coding tool specifically for UI design,"Google is launching Stitch, a new generative AI tool that helps developers swiftly turn rough UI ideas into functional, app-ready designs.",https://www.theverge.com/news/670773/google-labs-stitch-ui-coding-design-tool,2025-05-20T17:45:00Z,The Verge,https://platform.theverge.com/wp-content/uploads/sites/2/2025/05/Google-Labs-Stitch-UI-designer.jpg?quality=90&strip=all&crop=0%2C10.732984293194%2C100%2C78.534031413613&w=1200
"Six weeks on, Amazon Alexa+ shows few signs of public adoption","In February, Amazon confirmed the long-running rumors that it would be releasing a new Alexa assistant with integrated generative AI capabilities. The company promised it would be...",https://www.techspot.com/news/107965-six-weeks-amazon-alexa-shows-few-signs-public.html,2025-05-19T15:45:00Z,TechSpot,https://www.techspot.com/images2/news/bigimage/2020/11/2020-11-15-image.jpg
Diddy's Trial Recreated By AI Video Because of Courtroom Camera Ban,"With cameras banned in the courtroom, a TV station is recreating Sean “Diddy” Combs’ sex trafficking trial with generative AI.",https://petapixel.com/2025/05/19/sean-combs-diddy-diddys-trial-recreated-by-ai-video-because-of-courtroom-camera-ban-generative-ai/,2025-05-19T15:09:39Z,PetaPixel,https://petapixel.com/assets/uploads/2025/05/diddy-trial-ai-generated-video.jpg
A new headache for honest students: proving they didn’t use A.I.,"Generative AI tools including ChatGPT are reshaping education for the students who use them to cut corners. According to a Pew Research survey conducted last year, 26% of teenagers said they had used ChatGPT for schoolwork, double the rate of the previous year.",https://www.bostonglobe.com/2025/05/18/lifestyle/new-headache-honest-students-proving-they-didnt-use-ai/,2025-05-18T04:00:00Z,The Boston Globe,https://bostonglobe-prod.cdn.arcpublishing.com/resizer/v2/T2O5FLLPTEF6EH527NGK5R5NKA.jpg?auth=c325d5b788cfbe41a5ec9c36439b3227d19fef6a04c2e479adbb798cc404b6f6&width=1440
"As more Australians use AI chatbots as personal therapists, experts have urged caution","More Australians are accessing generative AI chatbots for emotional guidance and assistance — seeing it as a free, personal therapist. But experts have sounded a note of caution.",https://www.abc.net.au/news/2025-05-18/people-using-artificial-intelligence-as-therapy/105266076,2025-05-18T00:09:09Z,ABC News,https://live-production.wcms.abc-cdn.net.au/b70e4837ee7701c4b0a455dc23abfbdc?impolicy=wcms_watermark_news&cropH=2813&cropW=5000&xPos=0&yPos=260&width=862&height=485&imformat=generic
Genpact Moves Beyond Automation to Build Agentic Enterprises,"The race to redefine enterprise operations with generative AI is well underway. While many companies are experimenting with automation and intelligent tools, Genpact is taking a more structured and ambitious path.",https://analyticsindiamag.com/global-tech/genpact-moves-beyond-automation-to-build-agentic-enterprises/,2025-05-16T14:07:01Z,Analytics India Magazine,https://analyticsindiamag.com/wp-content/uploads/2025/05/I5D9026-scaled.jpg
"AI can be more persuasive than humans in debates, scientists find",Study author warns of implications for elections and says ‘malicious actors’ are probably using LLM tools already,https://www.theguardian.com/technology/2025/may/19/ai-can-be-more-persuasive-than-humans-in-debates-scientists-find-implications-for-elections,2025-05-19T15:00:32Z,The Guardian,https://i.guim.co.uk/img/media/4d0597b47d33b35c33fc9483c57837ebf4891845/326_0_2841_2274/master/2841.jpg?width=1200&height=630&quality=85&auto=format&fit=crop&overlay-align=bottom%2Cleft&overlay-width=100p&overlay-base64=L2ltZy9zdGF0aWMvb3ZlcmxheXMvdGctZGVmYXVsdC5wbmc&enable=upscale&s=e44f1851eb7f8236e62b564f4c631568
‘This is a crisis’: New Apple report claims we’ll get no Siri upgrades at WWDC 2025 due to AI turmoil,LLM Siri is on the way,https://www.techradar.com/computing/artificial-intelligence/this-is-a-crisis-new-apple-report-claims-well-get-no-siri-upgrades-at-wwdc-2025-due-to-ai-turmoil,2025-05-19T11:04:45Z,TechRadar,https://cdn.mos.cms.futurecdn.net/nkZ9GXo9yHfpPVvhqS776Q.jpg
Apple is trying to get ‘LLM Siri’ back on track,Bloomberg’s Mark Gurman details why Apple Intelligence is such a disaster and how Apple plans to save it.,https://www.theverge.com/news/669238/apple-siri-llm-ai-revamp,2025-05-18T23:06:37Z,The Verge,https://platform.theverge.com/wp-content/uploads/sites/2/2025/04/STK071_APPLE_H.jpg?quality=90&strip=all&crop=0%2C10.732984293194%2C100%2C78.534031413613&w=1200
Pocket FM is training its AI model to scale storytelling. Is the investment worth it?,Pocket FM expects the LLM to be ready five to six months after that. But experts are divided on whether building a domain-specific language model is worth the cost and can help in the long run.,https://www.livemint.com/companies/start-ups/pocket-fm-ai-model-storytelling-nvidia-pocket-fm-ai-model-pocket-fm-llm-pocket-fm-expansion-pocket-fm-revenue-11746947665512.html,2025-05-18T18:30:00Z,Livemint,https://www.livemint.com/lm-img/img/2025/05/19/1600x900/Pocket_FM_Co_Founders_1744032159717_1747633523412.JPG
How to install and use Ollama for LLMs on your Windows 11 PC,"If you want to install and use an AI LLM locally on your PC, one of the easiest ways to do it is with Ollama. Here's how to get up and rolling.",https://www.windowscentral.com/software-apps/how-to-install-and-use-ollama-to-run-ai-llms-on-your-windows-11-pc,2025-05-12T16:48:37Z,Windows Central,https://cdn.mos.cms.futurecdn.net/BCUUdbxFsGz8BaboQJG4mH.jpg
I created a local AI chatbot using PowerToys Run and Ollama,"By using a plugin and Ollama to run an LLM on your local machine, it's possible to turn PowerToys Run into your own AI chatbot. Even if I don't necessarily recommend it right now.",https://www.windowscentral.com/software-apps/i-turned-powertoys-run-into-an-ai-chatbot-and-while-it-feels-like-a-proof-of-concept-its-still-very-impressive,2025-05-12T13:37:14Z,Windows Central,https://cdn.mos.cms.futurecdn.net/6WayggxB8m4L3YuDmbvkd3.jpg
Fine-tuning vs. in-context learning: New research guides better LLM customization for real-world tasks,"By combining fine-tuning and in-context learning, you get LLMs that can learn tasks that would be too difficult or expensive for either method",https://venturebeat.com/ai/fine-tuning-vs-in-context-learning-new-research-guides-better-llm-customization-for-real-world-tasks/,2025-05-10T00:23:09Z,VentureBeat,https://venturebeat.com/wp-content/themes/vb-news/img/favicon.ico
